source_name,query,category,title,title_key,price,old_price,discount_pct,currency_id,sold_quantity,demand_signal_type,demand_signal_value,rating,reviews_count,seller_text,shipping_text,item_url,image_url,is_sponsored,is_full,is_catalog,fetched_date,fetched_at,source_file,source_record_id
kabum,webcam,webcam,"Webcam Elgato Facecam MK.2, FHD, 60 FPS, USB Tipe-C, Preto - 10WAC9901",webcam elgato facecam mk 2 fhd 60 fps usb tipe c preto 10wac9901,839.90,,,BRL,,retailer_offer,,,,,,https://www.kabum.com.br/produto/593735/webcam-elgato-facecam-mk-2-fhd-60-fps-usb-tipe-c-preto-10wac9901,https://images.kabum.com.br/produtos/fotos/593735/webcam-elgato-facecam-mk-2-fhd-60-fps-usb-tipe-c-preto-10wac9901_1728932845_m.jpg,False,False,False,2026-05-02,2026-05-02 04:23:44.631 -0300,market_web_listings_raw_202605041156.csv,07031300-49bb-44bb-b2dd-c52c1841446a
amazon,combo teclado mouse,mouse,"Combo Teclado e Mouse Bluetooth Ultrafino Sem Fio, Portátil e Recarregável E Teclado sem Fio - Compatível com Tablets Android, Celular, Smartphone, iPhone, iPad mini, Pro Air 10.2 10.9 11 12.9",combo teclado mouse bluetooth ultrafino sem fio portatil recarregavel teclado sem fio compativel tablets android celular smartphone iphone,42.65,,,BRL,3000,bsr_or_reviews_proxy,3000.00,1.0,1000,,"Patrocinado Combo Teclado e Mouse Bluetooth Ultrafino Sem Fio, Portátil e Recarregável E Teclado sem Fio - Compatível com Tablets Android, Celular, Smartphone, iPhone, iPad mini, Pro Air 10.2 10.9 11 12.9 4,3 4,3 de 5 estrelas (1 mil) Mais de 3 mil compras no mês passado Ofertas 5.5 Preço, página do produto R$ 42,65 R$42 , 65 De: R$ 44,90 De: R$ 44,90 R$44,90 em até 2x de R$ 21,32 R$21,32 sem juros Mais por Menos: 5% off em 5+ itens Entrega GRÁTIS: Hoje no seu primeiro pedido Adicionar ao carrinho",https://www.amazon.com.br/sspa/click,https://m.media-amazon.com/images/I/51o16JyN-rL._AC_UL320_.jpg,True,True,False,2026-05-03,2026-05-03 01:03:02.197 -0300,market_web_listings_raw_202605041156.csv,e9fac342-78c8-4fbc-81d1-ebee9531c3af
aliexpress,mouse sem fio,mouse,GOOJODOQ Bluetooth + 2.4G Mouse de modo duplo recarregável luz colorida 800-1200-1600 DPI clique silencioso design ergonômico,goojodoq bluetooth 2 4g mouse modo duplo recarregavel luz colorida 800 1200 1600 dpi clique silencioso design ergonomico,29.00,,,BRL,4000,sold_quantity_text,4000.00,,,,,https://pt.aliexpress.com/item/1005010363444764.html,https://ae-pic-a1.aliexpress-media.com/kf/S638bd3201b064bee8895b14301b60475D.jpg_480x480q75.jpg_.avif,False,False,False,2026-05-02,2026-05-02 05:44:54.060 -0300,market_web_listings_raw_202605041156.csv,86804b4a-509f-4d6e-9667-b2d8354374a8
amazon,combo teclado mouse,mouse,"Dell - KM3322W, Teclado e Mouse sem fio, Preto",dell km3322w teclado mouse sem fio preto,129.99,,,BRL,3000,bsr_or_reviews_proxy,3000.00,3.0,10300,,"Escolha da Amazon Dell - KM3322W, Teclado e Mouse sem fio, Preto 4,7 4,7 de 5 estrelas (10,3 mil) Mais de 3 mil compras no mês passado Preço, página do produto R$ 129,99 R$129 , 99 De: R$ 152,00 De: R$ 152,00 R$152,00 em até 4x de R$ 32,49 R$32,49 sem juros 90 dias de Amazon Music grátis incluso Entrega GRÁTIS: Hoje no seu primeiro pedido Adicionar ao carrinho",https://www.amazon.com.br/dp/B0BPTK4P38,https://m.media-amazon.com/images/I/51IPtedWrsL._AC_UL320_.jpg,False,True,False,2026-05-02,2026-05-02 08:05:52.786 -0300,market_web_listings_raw_202605041156.csv,a3502812-620d-4348-9f1f-0904d62d4da1
amazon,combo teclado mouse,mouse,"Combo Teclado e Mouse Bluetooth Ultrafino Sem Fio, Portátil e Recarregável E Teclado sem Fio - Compatível com Tablets Android, Celular, Smartphone, iPhone, iPad mini, Pro Air 10.2 10.9 11 12.9",combo teclado mouse bluetooth ultrafino sem fio portatil recarregavel teclado sem fio compativel tablets android celular smartphone iphone,42.65,,,BRL,2000,bsr_or_reviews_proxy,2000.00,1.0,1000,,"Combo Teclado e Mouse Bluetooth Ultrafino Sem Fio, Portátil e Recarregável E Teclado sem Fio - Compatível com Tablets Android, Celular, Smartphone, iPhone, iPad mini, Pro Air 10.2 10.9 11 12.9 4,3 4,3 de 5 estrelas (1 mil) Mais de 2 mil compras no mês passado Ofertas 5.5 Preço, página do produto R$ 42,65 R$42 , 65 De: R$ 44,90 De: R$ 44,90 R$44,90 em até 2x de R$ 21,32 R$21,32 sem juros Mais por Menos: 5% off em 5+ itens Entrega GRÁTIS: Hoje no seu primeiro pedido Adicionar ao carrinho",https://www.amazon.com.br/dp/B0FKKQV96P,https://m.media-amazon.com/images/I/51o16JyN-rL._AC_UL320_.jpg,False,True,False,2026-05-02,2026-05-02 04:13:44.340 -0300,market_web_listings_raw_202605041156.csv,8474a380-aaf5-4722-bdc3-eb620ed0f6a2
amazon,combo teclado mouse,mouse,"Combo Teclado e Mouse sem fio Logitech MK220 com Design Compacto, Conexão USB, Pilhas Inclusas e Layout ABNT2",combo teclado mouse sem fio logitech mk220 design compacto conexao usb pilhas inclusas layout abnt2,126.99,,,BRL,500,bsr_or_reviews_proxy,500.00,2.0,15500,,"Combo Teclado e Mouse sem fio Logitech MK220 com Design Compacto, Conexão USB, Pilhas Inclusas e Layout ABNT2 4,7 4,7 de 5 estrelas (15,5 mil) Mais de 500 compras no mês passado Preço, página do produto R$ 126,99 R$126 , 99 em até 4x de R$ 31,74 R$31,74 sem juros 90 dias de Amazon Music grátis incluso Entrega GRÁTIS: Hoje no seu primeiro pedido Ou entrega mais rápida: Hoje 07:00 - 10:59 Adicionar ao carrinho Mais opções de compra R$ 110,00(36 ofertas de novos)",https://www.amazon.com.br/dp/B074WGVBD2,https://m.media-amazon.com/images/I/51eu4O70lpL._AC_UL320_.jpg,False,True,False,2026-05-02,2026-05-02 04:13:44.340 -0300,market_web_listings_raw_202605041156.csv,2f061554-2fb9-43ff-8015-a56600e9af7f
amazon,combo teclado mouse,mouse,"Combo Teclado e Mouse Sem Fio Logitech MK250 Bluetooth com Conectividade Rápida e Fácil, Design Compacto, Mouse Ambidestro, Layout ABNT2, Construção Durável, Compatível com PC e Mac - Grafite",combo teclado mouse sem fio logitech mk250 bluetooth conectividade rapida facil design compacto mouse ambidestro layout abnt2 construcao,119.00,,,BRL,1000,bsr_or_reviews_proxy,1000.00,2.0,707,,"Combo Teclado e Mouse Sem Fio Logitech MK250 Bluetooth com Conectividade Rápida e Fácil, Design Compacto, Mouse Ambidestro, Layout ABNT2, Construção Durável, Compatível com PC e Mac - Grafite 4,7 4,7 de 5 estrelas (707) Mais de 1 mil compras no mês passado Ofertas 5.5 Preço, página do produto R$ 119,00 R$119 , 00 De: R$ 169,90 De: R$ 169,90 R$169,90 em até 3x de R$ 39,66 R$39,66 sem juros 90 dias de Amazon Music grátis incluso Entrega GRÁTIS: Hoje no seu primeiro pedido Adicionar ao carrinho",https://www.amazon.com.br/dp/B0FLFWP47Z,https://m.media-amazon.com/images/I/618iLr2V14L._AC_UL320_.jpg,False,True,False,2026-05-03,2026-05-03 11:03:43.445 -0300,market_web_listings_raw_202605041156.csv,697df58e-3a03-45e5-8fb5-648fd5454540
amazon,combo teclado mouse,mouse,"Combo Teclado e Mouse sem fio Logitech MK235 com Conexão USB, Pilhas Inclusas e Layout ABNT2",combo teclado mouse sem fio logitech mk235 conexao usb pilhas inclusas layout abnt2,119.80,,,BRL,1000,bsr_or_reviews_proxy,1000.00,2.0,21100,,"Combo Teclado e Mouse sem fio Logitech MK235 com Conexão USB, Pilhas Inclusas e Layout ABNT2 4,7 4,7 de 5 estrelas (21,1 mil) Mais de 1 mil compras no mês passado Ofertas 5.5 Preço, página do produto R$ 119,80 R$119 , 80 De: R$ 149,90 De: R$ 149,90 R$149,90 em até 3x de R$ 39,93 R$39,93 sem juros 90 dias de Amazon Music grátis incluso Entrega GRÁTIS: Hoje no seu primeiro pedido Adicionar ao carrinho",https://www.amazon.com.br/dp/B07643MPGS,https://m.media-amazon.com/images/I/61vdNn+737L._AC_UL320_.jpg,False,True,False,2026-05-03,2026-05-03 11:03:43.445 -0300,market_web_listings_raw_202605041156.csv,b3ee1852-e2d9-403b-ac5d-aed1ef0ec76a
amazon,combo teclado mouse,mouse,"Combo Teclado e Mouse Sem Fio Logitech MK250 Bluetooth com Conectividade Rápida e Fácil, Design Compacto, Mouse Ambidestro, Layout ABNT2, Construção Durável, Compatível com PC e Mac - Branco",combo teclado mouse sem fio logitech mk250 bluetooth conectividade rapida facil design compacto mouse ambidestro layout abnt2 construcao,119.00,,,BRL,1000,bsr_or_reviews_proxy,1000.00,2.0,707,,"Combo Teclado e Mouse Sem Fio Logitech MK250 Bluetooth com Conectividade Rápida e Fácil, Design Compacto, Mouse Ambidestro, Layout ABNT2, Construção Durável, Compatível com PC e Mac - Branco 4,7 4,7 de 5 estrelas (707) Mais de 1 mil compras no mês passado Ofertas 5.5 Preço, página do produto R$ 119,00 R$119 , 00 De: R$ 169,90 De: R$ 169,90 R$169,90 em até 3x de R$ 39,66 R$39,66 sem juros 90 dias de Amazon Music grátis incluso Entrega GRÁTIS no seu primeiro pedido Somente 9 em estoque. Adicionar ao carrinho Mais opções de compra R$ 101,15(10 ofertas de produtos novos e usados)",https://www.amazon.com.br/dp/B0FHJ8QQB8,https://m.media-amazon.com/images/I/613oddY7z4L._AC_UL320_.jpg,False,True,False,2026-05-03,2026-05-03 11:03:43.445 -0300,market_web_listings_raw_202605041156.csv,a581b96f-b446-4712-b6bc-b3b8de9e8304
amazon,combo teclado mouse,mouse,"Combo Teclado e Mouse sem fio Logitech MK345 com Teclado com Apoio para as Mãos e Mouse Destro, Conexão USB, Pilhas Inclusas e Layout ABNT2",combo teclado mouse sem fio logitech mk345 teclado apoio as maos mouse destro conexao usb pilhas inclusas layout,166.42,,,BRL,500,bsr_or_reviews_proxy,500.00,3.0,4100,,"Combo Teclado e Mouse sem fio Logitech MK345 com Teclado com Apoio para as Mãos e Mouse Destro, Conexão USB, Pilhas Inclusas e Layout ABNT2 4,7 4,7 de 5 estrelas (4,1 mil) Mais de 500 compras no mês passado R$ 166,42 R$166 , 42 R$ 199,90 R$199,90 à vista no Pix ou NuPay Limite Adicional ou em até 6x de R$ 30,81 R$30,81 sem juros Entrega GRÁTIS: Hoje no seu primeiro pedido Adicionar ao carrinho Mais opções de compra R$ 182,00(32 ofertas de novos)",https://www.amazon.com.br/dp/B075KD78F8,https://m.media-amazon.com/images/I/61SlbgSisZL._AC_UL320_.jpg,False,True,False,2026-05-03,2026-05-03 01:03:02.197 -0300,market_web_listings_raw_202605041156.csv,7c96363b-deba-4d2e-8b5d-a3d884cecce2
amazon,combo teclado mouse,mouse,"Combo de teclado e mouse Bluetooth ultrafino, portátil, recarregável, teclado sem fio para tablet Android, celular, smartphone, iPhone, iPad mini, Pro Air 10.2 10.9 11 12.9 33.0 cm (preto)",combo teclado mouse bluetooth ultrafino portatil recarregavel teclado sem fio tablet android celular smartphone iphone ipad mini pro,46.99,,,BRL,300,bsr_or_reviews_proxy,300.00,1.0,1500,,,https://www.amazon.com.br/dp/B098QKHRGK,https://m.media-amazon.com/images/I/61KlLFtv-3L._AC_UL320_.jpg,False,False,False,2026-05-02,2026-05-02 04:13:44.340 -0300,market_web_listings_raw_202605041156.csv,2dc1364c-a061-4d01-8a0c-e1b6e4251f94
amazon,combo teclado mouse,mouse,"Combo de Teclado e Mouse sem Fio HP 330 - com 1600 DPI, Dongle USB Wireless, Digitação Silenciosa, Precisa e Confortável, Layout ABNT2, Preto (2V9E6AA#AC4)",combo teclado mouse sem fio hp 330 1600 dpi dongle usb wireless digitacao silenciosa precisa confortavel layout abnt2,136.00,,,BRL,100,bsr_or_reviews_proxy,100.00,3.0,608,,"Combo de Teclado e Mouse sem Fio HP 330 - com 1600 DPI, Dongle USB Wireless, Digitação Silenciosa, Precisa e Confortável, Layout ABNT2, Preto (2V9E6AA#AC4) 4,4 4,4 de 5 estrelas (608) Mais de 100 compras no mês passado Preço, página do produto R$ 136,00 R$136 , 00 De: R$ 144,90 De: R$ 144,90 R$144,90 em até 4x de R$ 34,00 R$34,00 sem juros Só no app: até 10% off em Eletrônicos Entrega GRÁTIS: Hoje no seu primeiro pedido Adicionar ao carrinho",https://www.amazon.com.br/dp/B0CVNM2NQN,https://m.media-amazon.com/images/I/411Px+3tn-L._AC_UL320_.jpg,False,True,False,2026-05-02,2026-05-02 04:13:44.340 -0300,market_web_listings_raw_202605041156.csv,0d9b80e0-a443-4156-8148-efc566c7a0c5
amazon,combo teclado mouse,mouse,"Combo Teclado e Mouse com fio USB Logitech MK120 com Design Confortável, Durável e Resistente à Respingos, USB e Layout ABNT2",combo teclado mouse fio usb logitech mk120 design confortavel duravel resistente respingos usb layout abnt2,98.99,,,BRL,100,bsr_or_reviews_proxy,100.00,1.0,2100,,"Combo Teclado e Mouse com fio USB Logitech MK120 com Design Confortável, Durável e Resistente à Respingos, USB e Layout ABNT2 N.º 1 entre os melhores avaliados 4,8 4,8 de 5 estrelas (2,1 mil) Mais de 100 compras no mês passado R$ 98,99 R$98 , 99 R$ 116,46 R$116,46 à vista no Pix ou NuPay Limite Adicional ou em até 3x de R$ 38,82 R$38,82 sem juros Entrega GRÁTIS: Amanhã, 4 de mai. no seu primeiro pedido Adicionar ao carrinho Mais opções de compra R$ 115,30(29 ofertas de novos)",https://www.amazon.com.br/dp/B074WKLRYT,https://m.media-amazon.com/images/I/61s6lTyu02L._AC_UL320_.jpg,False,True,False,2026-05-03,2026-05-03 01:03:02.197 -0300,market_web_listings_raw_202605041156.csv,6680d846-9419-4a12-8524-22d1f38d6e35
amazon,combo teclado mouse,mouse,"Combo Teclado e Mouse sem fio Logitech MK295 com Digitação e Clique Silencioso, Teclas de Mídia de Fácil Acesso, Conexão USB, Pilhas Inclusas e Layout ABNT2",combo teclado mouse sem fio logitech mk295 digitacao clique silencioso teclas midia facil acesso conexao usb pilhas inclusas,176.00,,,BRL,300,bsr_or_reviews_proxy,300.00,2.0,3100,,"Combo Teclado e Mouse sem fio Logitech MK295 com Digitação e Clique Silencioso, Teclas de Mídia de Fácil Acesso, Conexão USB, Pilhas Inclusas e Layout ABNT2 4,7 4,7 de 5 estrelas (3,1 mil) Mais de 300 compras no mês passado Preço, página do produto R$ 176,00 R$176 , 00 De: R$ 229,90 De: R$ 229,90 R$229,90 em até 5x de R$ 35,20 R$35,20 sem juros 90 dias de Amazon Music grátis incluso Entrega GRÁTIS: ter., 5 de mai. no seu primeiro pedido Adicionar ao carrinho",https://www.amazon.com.br/dp/B08JD18BD3,https://m.media-amazon.com/images/I/61lpjzSzVPL._AC_UL320_.jpg,False,True,False,2026-05-02,2026-05-02 04:13:44.340 -0300,market_web_listings_raw_202605041156.csv,3b59f360-3e16-4ac8-b17f-df819c954bad
amazon,combo teclado mouse,mouse,"Combo de Teclado e Mouse USB HP 150 - Plug and Play, com Digitação Silenciosa, Confortável e Precisa, Mouse com DPI de 1600, Layout ABNT2, Preto (240J7AA)",combo teclado mouse usb hp 150 plug and play digitacao silenciosa confortavel precisa mouse dpi 1600 layout abnt2,95.99,,,BRL,50,bsr_or_reviews_proxy,50.00,1.0,286,,,https://www.amazon.com.br/dp/B0D6SRSGX8,https://m.media-amazon.com/images/I/51xoqVbMuWL._AC_UL320_.jpg,False,False,False,2026-05-02,2026-05-02 15:04:42.466 -0300,market_web_listings_raw_202605041156.csv,06837248-3784-4372-9421-90dcc89523bd
amazon,combo teclado mouse,mouse,"Combo Teclado e Mouse sem fio Logitech MK540 com Teclado com Apoio para as Mãos, Teclas de Mídia de Fácil Acesso, Mouse Ambidestro, Conexão USB, Pilhas Inclusas e Layout ABNT2",combo teclado mouse sem fio logitech mk540 teclado apoio as maos teclas midia facil acesso mouse ambidestro conexao,275.56,,,BRL,200,bsr_or_reviews_proxy,200.00,5.0,4300,,"Combo Teclado e Mouse sem fio Logitech MK540 com Teclado com Apoio para as Mãos, Teclas de Mídia de Fácil Acesso, Mouse Ambidestro, Conexão USB, Pilhas Inclusas e Layout ABNT2 4,7 4,7 de 5 estrelas (4,3 mil) Mais de 200 compras no mês passado Preço, página do produto R$ 275,56 R$275 , 56 De: R$ 299,00 De: R$ 299,00 R$299,00 em até 6x de R$ 45,92 R$45,92 sem juros 90 dias de Amazon Music grátis incluso Entrega GRÁTIS: ter., 5 de mai. no seu primeiro pedido Adicionar ao carrinho",https://www.amazon.com.br/dp/B07C55K2YS,https://m.media-amazon.com/images/I/61J+g-r1uML._AC_UL320_.jpg,False,True,False,2026-05-02,2026-05-02 04:13:44.340 -0300,market_web_listings_raw_202605041156.csv,4ef839ca-ef62-4f5d-afae-8056ae7cef2c
amazon,combo teclado mouse,mouse,Combo Mouse e Teclado CCI 20 Preto Intelbras,combo mouse teclado cci 20 preto intelbras,66.26,,,BRL,,bsr_or_reviews_proxy,48.00,2.0,48,,,https://www.amazon.com.br/dp/B0C3NPVVHK,https://m.media-amazon.com/images/I/5150u+m+FzL._AC_UL320_.jpg,False,False,False,2026-05-02,2026-05-02 04:13:44.340 -0300,market_web_listings_raw_202605041156.csv,5170ed36-29b4-4349-a1d3-58388b80d120
amazon,combo teclado mouse,mouse,"Combo Teclado e Mouse sem fio Logitech MK470 com Design Slim, Digitação e Clique Silencioso, Mouse Ambidestro, Conexão USB e Pilhas Inclusas - Rosa",combo teclado mouse sem fio logitech mk470 design slim digitacao clique silencioso mouse ambidestro conexao usb pilhas inclusas,289.90,,,BRL,50,bsr_or_reviews_proxy,50.00,4.0,3500,,"Combo Teclado e Mouse sem fio Logitech MK470 com Design Slim, Digitação e Clique Silencioso, Mouse Ambidestro, Conexão USB e Pilhas Inclusas - Rosa 4,7 4,7 de 5 estrelas (3,5 mil) Mais de 50 compras no mês passado R$ 289,90 R$289 , 90 R$ 334,90 R$334,90 à vista no Pix ou NuPay Limite Adicional ou em até 6x de R$ 50,50 R$50,50 sem juros Entrega GRÁTIS: Hoje no seu primeiro pedido Ou entrega mais rápida: Hoje 07:00 - 10:59 Adicionar ao carrinho",https://www.amazon.com.br/dp/B0BVPHM7VG,https://m.media-amazon.com/images/I/61gqiuMeEaL._AC_UL320_.jpg,False,True,False,2026-05-03,2026-05-03 01:03:02.197 -0300,market_web_listings_raw_202605041156.csv,98610992-adf8-4d3e-9922-37e9ab9e9107
amazon,combo teclado mouse,mouse,Combo Teclado e Mouse Bluetooth Sem Fio Portátil e Recarregável Compatível com Tablets e PCs Ultrafino Kit (Branco),combo teclado mouse bluetooth sem fio portatil recarregavel compativel tablets pcs ultrafino kit branco,51.99,,,BRL,,bsr_or_reviews_proxy,5.00,5.0,5,,"Combo Teclado e Mouse Bluetooth Sem Fio Portátil e Recarregável Compatível com Tablets e PCs Ultrafino Kit (Branco) 5,0 5,0 de 5 estrelas (5) Ofertas 5.5 Preço, página do produto R$ 51,99 R$51 , 99 De: R$ 59,99 De: R$ 59,99 R$59,99 em até 2x de R$ 25,99 R$25,99 sem juros Entrega GRÁTIS: Hoje no seu primeiro pedido Adicionar ao carrinho",https://www.amazon.com.br/dp/B0GQGLHFXP,https://m.media-amazon.com/images/I/61+kuNxTmRL._AC_UL320_.jpg,False,True,False,2026-05-02,2026-05-02 04:13:44.340 -0300,market_web_listings_raw_202605041156.csv,bb7ca798-6eab-4358-925f-bb06d1fa15f1
amazon,fone bluetooth,headset_fone,Fone de Ouvido USB Tipo-C com Microfone Integrado - Isolamento de Ruído - Controles de Áudio no Cabo - Compatível com Smartphones e Tablets USB-C,fone ouvido usb tipo c microfone integrado isolamento ruido controles audio no cabo compativel smartphones tablets usb c,19.99,,,BRL,,bsr_or_reviews_proxy,205.00,3.9,205,,"Patrocinado Fone de Ouvido USB Tipo-C com Microfone Integrado - Isolamento de Ruído - Controles de Áudio no Cabo - Compatível com Smartphones e Tablets USB-C 3,9 3,9 de 5 estrelas (205) Preço, página do produto R$ 19,99 R$19 , 99 De: R$ 39,99 De: R$ 39,99 R$39,99 Mais por Menos: 5% off em 5+ itens Entrega GRÁTIS: Hoje no seu primeiro pedido Chega antes do Dia das Mães Somente 8 em estoque. Pequenas empresas Adicionar ao carrinho",https://www.amazon.com.br/sspa/click,https://m.media-amazon.com/images/I/51bA7BQKGJL._AC_UL320_.jpg,True,True,False,2026-05-03,2026-05-03 06:03:09.380 -0300,market_web_listings_raw_202605041156.csv,6d24daf8-7165-4f98-a25e-864697a266e5
amazon,fone bluetooth,headset_fone,"soundcore P20i da Anker, Fone de Ouvido Bluetooth 5.3, Graves Potentes, Drivers de 10mm, 30H de Reprodução, Resistência à Água, 2 Mics IA, Personalização de Som via App, Fone sem fio tws, Preto",soundcore p20i anker fone ouvido bluetooth 5 3 graves potentes drivers 10mm 30h reproducao resistencia agua 2 mics,166.00,,,BRL,2000,bsr_or_reviews_proxy,2000.00,2.0,102600,,"Escolha da Amazon soundcore P20i da Anker, Fone de Ouvido Bluetooth 5.3, Graves Potentes, Drivers de 10mm, 30H de Reprodução, Resistência à Água, 2 Mics IA, Personalização de Som via App, Fone sem fio tws, Preto 4,6 4,6 de 5 estrelas (102,6 mil) Mais de 2 mil compras no mês passado Ofertas 5.5 Preço, página do produto R$ 166,00 R$166 , 00 De: R$ 249,00 De: R$ 249,00 R$249,00 em até 5x de R$ 33,20 R$33,20 sem juros Entrega GRÁTIS: Hoje no seu primeiro pedido Chega antes do Dia das Mães Pegada de carbono Adicionar ao carrinho",https://www.amazon.com.br/dp/B0BTYCRJSS,https://m.media-amazon.com/images/I/61ljZu9+GXL._AC_UL320_.jpg,False,True,False,2026-05-02,2026-05-02 04:13:56.828 -0300,market_web_listings_raw_202605041156.csv,46a15b5e-6dcc-493b-8854-224f2d4637f3
amazon,fone bluetooth,headset_fone,"Fone de Ouvido Sem Fio, JBL, Bluetooth, Wave Beam 2, Intra Auricular, Sem Fio, Resistente À Água e Poeira - Preto",fone ouvido sem fio jbl bluetooth wave beam 2 intra auricular sem fio resistente agua poeira preto,268.13,,,BRL,4000,bsr_or_reviews_proxy,4000.00,2.0,6400,,"Fone de Ouvido Sem Fio, JBL, Bluetooth, Wave Beam 2, Intra Auricular, Sem Fio, Resistente À Água e Poeira - Preto 4,6 4,6 de 5 estrelas (6,4 mil) Mais de 4 mil compras no mês passado Preço, página do produto R$ 268,13 R$268 , 13 De: R$ 369,00 De: R$ 369,00 R$369,00 em até 8x de R$ 33,51 R$33,51 sem juros 90 dias de Amazon Music grátis incluso Entrega GRÁTIS: Hoje no seu primeiro pedido Chega antes do Dia das Mães Adicionar ao carrinho",https://www.amazon.com.br/dp/B0DHL93XCN,https://m.media-amazon.com/images/I/61DFgTmj9xL._AC_UL320_.jpg,False,True,False,2026-05-03,2026-05-03 08:03:56.062 -0300,market_web_listings_raw_202605041156.csv,14b25fcf-ab9d-40be-bc1b-44c6f91e45e4
amazon,fone bluetooth,headset_fone,"PHILIPS, Headphone Bluetooth, TAH2300BK/00, Com Microfone, Até 55 horas de bateria, Design Over-ear, Dobrável, Preto",philips headphone bluetooth tah2300bk 00 microfone ate 55 horas bateria design over ear dobravel preto,130.40,,,BRL,500,bsr_or_reviews_proxy,500.00,2.0,1300,,"PHILIPS, Headphone Bluetooth, TAH2300BK/00, Com Microfone, Até 55 horas de bateria, Design Over-ear, Dobrável, Preto 4,7 4,7 de 5 estrelas (1,3 mil) Mais de 500 compras no mês passado Economize 12% Preço, página do produto R$ 130,40 R$130 , 40 De: R$ 149,00 De: R$ 149,00 R$149,00 em até 4x de R$ 32,60 R$32,60 sem juros 90 dias de Amazon Music grátis incluso Entrega GRÁTIS: Hoje no seu primeiro pedido Chega antes do Dia das Mães Adicionar ao carrinho",https://www.amazon.com.br/dp/B0FJMHMCBZ,https://m.media-amazon.com/images/I/51BmQ8K9sML._AC_UL320_.jpg,False,True,False,2026-05-02,2026-05-02 04:13:56.828 -0300,market_web_listings_raw_202605041156.csv,3bd1d8fb-8c98-44ae-bfe5-1c8bc232af0e
amazon,fone bluetooth,headset_fone,"Fone de ouvido sem fio TWS Philips TAT1209BK/00 na cor preto, com bluetooth, microfone, tecnologia IPX4 e 18 horas de reprodução.",fone ouvido sem fio tws philips tat1209bk 00 na cor preto bluetooth microfone tecnologia ipx4 18 horas reproducao,123.00,,,BRL,1000,bsr_or_reviews_proxy,1000.00,1.0,7000,,"Fone de ouvido sem fio TWS Philips TAT1209BK/00 na cor preto, com bluetooth, microfone, tecnologia IPX4 e 18 horas de reprodução. 4,6 4,6 de 5 estrelas (7 mil) Mais de 1 mil compras no mês passado Preço, página do produto R$ 123,00 R$123 , 00 em até 4x de R$ 30,75 R$30,75 sem juros Entrega GRÁTIS: Hoje no seu primeiro pedido Chega antes do Dia das Mães Adicionar ao carrinho Mais opções de compra R$ 122,31(22 ofertas de novos)",https://www.amazon.com.br/dp/B0CS3RHBZQ,https://m.media-amazon.com/images/I/51yHf2TFfUL._AC_UL320_.jpg,False,True,False,2026-05-02,2026-05-02 04:13:56.828 -0300,market_web_listings_raw_202605041156.csv,ea823a1e-bc4a-4c37-af3f-12b09e2f0cdf
amazon,fone bluetooth,headset_fone,"INAVA Fone de Ouvido Bluetooth 3ª Geração, 50 Horas de Bateria, Microfone com Cancelamento de Ruído (ENC), fone de ouvido esportivo Ergonômico, Ideal para Academia/Corrida/Trabalho (Preto)",inava fone ouvido bluetooth 3a geracao 50 horas bateria microfone cancelamento ruido enc fone ouvido esportivo ergonomico ideal,57.00,,,BRL,400,bsr_or_reviews_proxy,400.00,3.0,22,,"INAVA Fone de Ouvido Bluetooth 3ª Geração, 50 Horas de Bateria, Microfone com Cancelamento de Ruído (ENC), fone de ouvido esportivo Ergonômico, Ideal para Academia/Corrida/Trabalho (Preto) 4,6 4,6 de 5 estrelas (22) Mais de 400 compras no mês passado Ofertas 5.5 Preço, página do produto R$ 57,00 R$57 , 00 De: R$ 78,90 De: R$ 78,90 R$78,90 em até 2x de R$ 28,50 R$28,50 sem juros Entrega GRÁTIS: Hoje no seu primeiro pedido Chega antes do Dia das Mães Adicionar ao carrinho",https://www.amazon.com.br/dp/B0GSRB8D19,https://m.media-amazon.com/images/I/511ThB6ouuL._AC_UL320_.jpg,False,True,False,2026-05-02,2026-05-02 04:13:56.828 -0300,market_web_listings_raw_202605041156.csv,084a45d1-deeb-42e2-a2ad-735a9750a663
amazon,fone bluetooth,headset_fone,"PHILIPS, Headphone Bluetooth, TAH2209, Até 25 horas de bateria, Preto",philips headphone bluetooth tah2209 ate 25 horas bateria preto,119.70,,,BRL,2000,bsr_or_reviews_proxy,2000.00,2.0,1900,,"PHILIPS, Headphone Bluetooth, TAH2209, Até 25 horas de bateria, Preto 4,8 4,8 de 5 estrelas (1,9 mil) Mais de 2 mil compras no mês passado R$ 119,70 R$119 , 70 R$ 149,00 R$149,00 à vista no Pix ou NuPay Limite Adicional ou em até 4x de R$ 31,50 R$31,50 sem juros Entrega GRÁTIS: Hoje no seu primeiro pedido Chega antes do Dia das Mães Adicionar ao carrinho Mais opções de compra R$ 119,00(30 ofertas de novos)",https://www.amazon.com.br/dp/B0F5BQGVJM,https://m.media-amazon.com/images/I/41jjoSyX37L._AC_UL320_.jpg,False,True,False,2026-05-02,2026-05-02 04:13:56.828 -0300,market_web_listings_raw_202605041156.csv,5354fab8-a84e-44d5-9a8e-05f0e5158330
