source_name,query,category,title,title_key,price,old_price,discount_pct,currency_id,sold_quantity,demand_signal_type,demand_signal_value,rating,reviews_count,seller_text,shipping_text,item_url,image_url,is_sponsored,is_full,is_catalog,fetched_date,fetched_at,source_file,source_record_id
amazon,mouse sem fio,mouse,"ATTACK SHARK X11 Mouse sem fio leve, 62g, RGB, conexão tri-modo (2.4G/USB-C/BT), 22K DPI, sensor PAW3311, 5 botões programáveis, base de carregamento RGB, compatível com PC/Mac-Branco",attack shark x11 mouse sem fio leve 62g rgb conexao tri modo 2 4g usb c bt 22k,180.49,,,BRL,50,bsr_or_reviews_proxy,50.00,1.0,877,,"ATTACK SHARK X11 Mouse sem fio leve, 62g, RGB, conexão tri-modo (2.4G/USB-C/BT), 22K DPI, sensor PAW3311, 5 botões programáveis, base de carregamento RGB, compatível com PC/Mac-Branco 4,7 4,7 de 5 estrelas (877) Mais de 50 compras no mês passado R$ 180,49 R$180 , 49 R$ 249,99 R$249,99 à vista no Pix ou NuPay Limite Adicional ou em até 6x de R$ 31,66 R$31,66 sem juros Entrega GRÁTIS: Hoje no seu primeiro pedido Somente 3 em estoque. Adicionar ao carrinho",https://www.amazon.com.br/dp/B0D3KQVQXK,https://m.media-amazon.com/images/I/511ErkBZ2aL._AC_UL320_.jpg,False,True,False,2026-05-02,2026-05-02 12:56:14.504 -0300,market_web_listings_raw_202605041156.csv,5a216f4c-834b-4b47-9f45-70ce4a67c5bc
amazon,mouse sem fio,mouse,"Mouse Sem Fio Logitech Signature M650 L com Design de Tamanho Padrão, Clique Silencioso, Botões Laterais Personalizáveis, Conexão USB e Bluetooth - Grafite",mouse sem fio logitech signature m650 l design tamanho padrao clique silencioso botoes laterais personalizaveis conexao usb bluetooth,169.99,,,BRL,300,bsr_or_reviews_proxy,300.00,5.0,1800,,"Mouse Sem Fio Logitech Signature M650 L com Design de Tamanho Padrão, Clique Silencioso, Botões Laterais Personalizáveis, Conexão USB e Bluetooth - Grafite 4,8 4,8 de 5 estrelas (1,8 mil) Mais de 300 compras no mês passado Preço, página do produto R$ 169,99 R$169 , 99 De: R$ 229,90 De: R$ 229,90 R$229,90 em até 5x de R$ 33,99 R$33,99 sem juros 90 dias de Amazon Music grátis incluso Entrega GRÁTIS: Hoje no seu primeiro pedido Adicionar ao carrinho",https://www.amazon.com.br/dp/B09NQPBMSY,https://m.media-amazon.com/images/I/71ued9OR0WL._AC_UL320_.jpg,False,True,False,2026-05-02,2026-05-02 12:56:14.504 -0300,market_web_listings_raw_202605041156.csv,1ee71af1-c011-4369-abe5-8f5c51383c85
terabyte,mouse sem fio,mouse,Combo Mouse e Teclado Dr. Office SDR-0302-G Sem Fio,combo mouse teclado dr office sdr 0302 g sem fio,8.83,,,BRL,,retailer_offer,,,,,,https://www.terabyteshop.com.br/produto/23683/combo-mouse-e-teclado-dr-office-sdr-0302-g-sem-fio-usb-cinza-metalico,https://img.terabyteshop.com.br/produto/m/combo-mouse-e-teclado-dr-office-sdr-0302-g-sem-fio-usb-cinza-metalico_161304.png,False,False,False,2026-05-02,2026-05-02 12:56:19.596 -0300,market_web_listings_raw_202605041156.csv,016d8043-4dd4-4e5f-9a13-d03b8e889529
terabyte,mouse sem fio,mouse,Mouse Gamer MCHOSE A7 V2 Pro 26000 DPI 8K Branco,mouse gamer mchose a7 v2 pro 26000 dpi 8k branco,329.99,,,BRL,,retailer_offer,,,,,"Mouse Gamer MCHOSE A7 V2 Pro 26000 DPI 8K Branco | Terabyte De: R$ 388,22 R$ 329,99 12x de R$ 32,36 sem juros 🔥 em promoção Frete Grátis Periféricos",https://www.terabyteshop.com.br/produto/39796/mouse-gamer-mchose-a7-v2-pro-wireless-bluetooth-26000-dpi-8k-sensor-paw-3395-branco-mc-a7v2-2,https://img.terabyteshop.com.br/produto/m/mouse-gamer-mchose-a7-v2-pro-wireless-bluetooth-26000-dpi-8k-sensor-paw-3395-branco-mc-a7v2-2_257348.jpg,False,False,False,2026-05-02,2026-05-02 12:56:19.596 -0300,market_web_listings_raw_202605041156.csv,4d2d4f21-e57d-4aa3-89a8-2b2eb46ed7a8
terabyte,mouse sem fio,mouse,Mouse Gamer Corsair M65 Ultra RGB 26000 DPI 8 Botões,mouse gamer corsair m65 ultra rgb 26000 dpi 8 botoes,389.99,,,BRL,,retailer_offer,,,,,"Mouse Gamer Corsair M65 Ultra RGB 26000 DPI 8 Botões | Terabyte De: R$ 458,81 R$ 389,99 12x de R$ 38,24 sem juros 🔥 em promoção Frete Grátis Periféricos > Mouse",https://www.terabyteshop.com.br/produto/36224/mouse-gamer-corsair-m65-ultra-rgb-26000-dpi-8-botoes-preto-ch-9309411-na2,https://img.terabyteshop.com.br/produto/m/mouse-gamer-corsair-m65-ultra-rgb-26000-dpi-8-botoes-preto-ch-9309411-na2_238474.jpg,False,False,False,2026-05-02,2026-05-02 12:56:19.596 -0300,market_web_listings_raw_202605041156.csv,18ee6e2b-e36e-48be-8ace-e87712b3d643
terabyte,mouse sem fio,mouse,"Mouse Vinik Corp, USB, 1000 DPI, 3 Botões, Preto, CM100",mouse vinik corp usb 1000 dpi 3 botoes preto cm100,16.99,,,BRL,,retailer_offer,,,,,,https://www.terabyteshop.com.br/produto/37463/mouse-vinik-corp-usb-1000-dpi-3-botoes-preto-cm100,https://img.terabyteshop.com.br/produto/m/mouse-vinik-corp-usb-1000-dpi-3-botoes-preto-cm100_245163.jpg,False,False,False,2026-05-02,2026-05-02 12:56:19.596 -0300,market_web_listings_raw_202605041156.csv,0ddb3b0e-240b-454f-a98b-c88bee46f078
terabyte,mouse sem fio,mouse,Mouse Gamer Corsair Katar Elite Wireless 26K DPI RGB,mouse gamer corsair katar elite wireless 26k dpi rgb,429.99,,,BRL,,retailer_offer,,,,,"Mouse Gamer Corsair Katar Elite Wireless 26K DPI RGB | Terabyte De: R$ 505,87 R$ 429,99 12x de R$ 42,16 sem juros 🔥 em promoção Frete Grátis Periféricos > Mouse",https://www.terabyteshop.com.br/produto/25658/mouse-gamer-corsair-katar-elite-wireless-26000-dpi-6-botoes-rgb-black-ch-931c111-na,https://img.terabyteshop.com.br/produto/m/mouse-gamer-corsair-katar-elite-wireless-26000-dpi-6-botoes-rgb-black-ch-931c111-na_175793.jpg,False,False,False,2026-05-02,2026-05-02 12:56:19.596 -0300,market_web_listings_raw_202605041156.csv,09de6764-78b5-4104-af45-1e7ad55bdfac
terabyte,mouse sem fio,mouse,Mouse Logitech M90 1000 DPI USB Preto,mouse logitech m90 1000 dpi usb preto,34.90,,,BRL,,retailer_offer,,,,,,https://www.terabyteshop.com.br/produto/10459/mouse-logitech-m90-1000-dpi-usb-preto,https://img.terabyteshop.com.br/produto/m/mouse-logitech-m90-1000-dpi-usb-preto_247888.jpg,False,False,False,2026-05-02,2026-05-02 12:56:19.596 -0300,market_web_listings_raw_202605041156.csv,4da9c473-bee7-4ccd-9160-98f56d3f3f1e
terabyte,mouse sem fio,mouse,Mouse PCYes Soft Silent Click Wireless 1200 DPI,mouse pcyes soft silent click wireless 1200 dpi,44.99,,,BRL,,retailer_offer,,,,,,https://www.terabyteshop.com.br/produto/37448/mouse-pcyes-soft-silent-click-wireless-1200-dpi-3-botoes-preto-mssc12w,https://img.terabyteshop.com.br/produto/m/mouse-pcyes-soft-silent-click-wireless-1200-dpi-3-botoes-preto-mssc12w_245088.jpg,False,False,False,2026-05-02,2026-05-02 12:56:19.596 -0300,market_web_listings_raw_202605041156.csv,643012bf-9794-425d-a92a-a06ac566533e
terabyte,mouse sem fio,mouse,Mouse Gamer T-Dagger Darkangel V2 RGB 4000 DPI,mouse gamer t dagger darkangel v2 rgb 4000 dpi,69.90,,,BRL,,retailer_offer,,,,,,https://www.terabyteshop.com.br/produto/35932/mouse-gamer-t-dagger-darkangel-v2-rgb-4000-dpi-8-botoes-preto-t-tgm209-v2,https://img.terabyteshop.com.br/produto/m/mouse-gamer-t-dagger-darkangel-v2-rgb-4000-dpi-8-botoes-preto-t-tgm209-v2_236972.jpg,False,False,False,2026-05-02,2026-05-02 12:56:19.596 -0300,market_web_listings_raw_202605041156.csv,af6d1957-d39a-481b-9bec-a90ca3d9ec27
terabyte,mouse sem fio,mouse,Mouse Gamer PCYes Malus Black Vulcan 12400 DPI RGB,mouse gamer pcyes malus black vulcan 12400 dpi rgb,79.99,,,BRL,,retailer_offer,,,,,,https://www.terabyteshop.com.br/produto/36270/mouse-gamer-pcyes-malus-black-vulcan-rgb-12400-dpi-pwm-3327-6-botoes-preto-pmgmbv,https://img.terabyteshop.com.br/produto/m/mouse-gamer-pcyes-malus-black-vulcan-rgb-12400-dpi-pwm-3327-6-botoes-preto-pmgmbv_238693.jpg,False,False,False,2026-05-02,2026-05-02 12:56:19.596 -0300,market_web_listings_raw_202605041156.csv,2a9f586e-c449-4d24-85f0-29643700a37d
terabyte,combo teclado mouse,mousepad,"MousePad Gamer Round5 Slide BLK II, Extra Grande, 900x400mm, Preto",mousepad gamer round5 slide blk ii extra grande 900x400mm preto,69.99,,,BRL,,retailer_offer,,,,,,https://www.terabyteshop.com.br/produto/41238/mousepad-gamer-round5-slide-blk-ii-extra-grande-900x400mm-preto,https://img.terabyteshop.com.br/produto/m/mousepad-gamer-round5-slide-blk-ii-extra-grande-900x400mm-preto_266537.jpg,False,False,False,2026-05-02,2026-05-02 12:57:13.424 -0300,market_web_listings_raw_202605041156.csv,768f4ac2-e649-4fb7-bbb1-4944a2cc37ab
terabyte,combo teclado mouse,mousepad,"MousePad Gamer Round5 Slide Toronto, Extra Grande, 900x400mm, Preto",mousepad gamer round5 slide toronto extra grande 900x400mm preto,79.99,,,BRL,,retailer_offer,,,,,,https://www.terabyteshop.com.br/produto/41243/mousepad-gamer-round5-slide-toronto-extra-grande-900x400mm-preto,https://img.terabyteshop.com.br/produto/m/mousepad-gamer-round5-slide-toronto-extra-grande-900x400mm-preto_266547.jpg,False,False,False,2026-05-02,2026-05-02 12:57:13.424 -0300,market_web_listings_raw_202605041156.csv,03b4b753-5026-4c24-8540-2eb795c1af37
amazon,teclado gamer,teclado,"HyperX Teclado Gamer HyperX Alloy Core RGB, ABNT2, PRETO",hyperx teclado gamer hyperx alloy core rgb abnt2 preto,223.55,,,BRL,500,bsr_or_reviews_proxy,500.00,2.0,5500,,"HyperX Teclado Gamer HyperX Alloy Core RGB, ABNT2, PRETO 4,8 4,8 de 5 estrelas (5,5 mil) Mais de 500 compras no mês passado R$ 223,55 R$223 , 55 R$ 419,90 R$419,90 à vista no Pix ou NuPay Limite Adicional ou em até 6x de R$ 39,21 R$39,21 sem juros Entrega GRÁTIS no seu primeiro pedido Somente 1 em estoque. Adicionar ao carrinho",https://www.amazon.com.br/dp/B07TV9B7Z3,https://m.media-amazon.com/images/I/61XRKm0vZaL._AC_UL320_.jpg,False,True,False,2026-05-02,2026-05-02 16:08:20.978 -0300,market_web_listings_raw_202605041156.csv,f7dd425d-ac76-4119-9e5e-8bd7cc5f39b2
terabyte,teclado gamer,teclado,"Teclado Mecânico Gamer PCYes Shiyan White Ghost, RGB, Switch Outemu Blue, 60%, ABNT2, Branco, TPSHWGBL",teclado mecanico gamer pcyes shiyan white ghost rgb switch outemu blue 60 abnt2 branco tpshwgbl,199.99,,,BRL,,retailer_offer,,,,,,https://www.terabyteshop.com.br/produto/41128/teclado-mecanico-gamer-pcyes-shiyan-white-ghost-rgb-switch-outemu-blue-60-abnt2-branco-tpshwgbl,https://img.terabyteshop.com.br/produto/m/teclado-mecanico-gamer-pcyes-shiyan-white-ghost-rgb-switch-outemu-blue-60-abnt2-branco-tpshwgbl_266755.jpg,False,False,False,2026-05-02,2026-05-02 12:56:54.963 -0300,market_web_listings_raw_202605041156.csv,c55b32fa-ddfc-434d-a74e-3d7d0eabbdb3
terabyte,teclado gamer,teclado,"Teclado Mecânico Gamer PCYes Shiyan White Ghost, RGB, Switch Outemu Red, 60%, ABNT2, Branco, TPSHWGRD",teclado mecanico gamer pcyes shiyan white ghost rgb switch outemu red 60 abnt2 branco tpshwgrd,199.99,,,BRL,,retailer_offer,,,,,,https://www.terabyteshop.com.br/produto/41129/teclado-mecanico-gamer-pcyes-shiyan-white-ghost-rgb-switch-outemu-red-60-abnt2-branco-tpshwgrd,https://img.terabyteshop.com.br/produto/m/teclado-mecanico-gamer-pcyes-shiyan-white-ghost-rgb-switch-outemu-red-60-abnt2-branco-tpshwgrd_266765.jpg,False,False,False,2026-05-02,2026-05-02 12:56:54.963 -0300,market_web_listings_raw_202605041156.csv,b5b167ea-82c4-446a-ae78-f16e0b825540
terabyte,teclado gamer,teclado,"Teclado Mecânico Gamer PCYes Arkeum Black Vulcan, Rainbow, Switch Red, 75%, ABNT2, Preto, Cinza e Laranja, AKBV75RBR",teclado mecanico gamer pcyes arkeum black vulcan rainbow switch red 75 abnt2 preto cinza laranja akbv75rbr,219.99,,,BRL,,retailer_offer,,,,,,https://www.terabyteshop.com.br/produto/40604/teclado-mecanico-gamer-pcyes-arkeum-black-vulcan-rainbow-switch-red-75-abnt2-preto-cinza-e-laranja-akbv75rbr,https://img.terabyteshop.com.br/produto/m/teclado-mecanico-gamer-pcyes-arkeum-black-vulcan-rainbow-switch-red-75-abnt2-preto-cinza-e-laranja-akbv75rbr_263018.jpg,False,False,False,2026-05-02,2026-05-02 12:56:54.963 -0300,market_web_listings_raw_202605041156.csv,5f0e5da0-06eb-43c1-b59b-5a0016c4e2df
terabyte,teclado gamer,teclado,"Teclado Mecânico Gamer PCYes Arkeum Black Vulcan, Rainbow, Switch Blue, 75%, ABNT2, Preto, Cinza e Laranja, AKBV75BBR",teclado mecanico gamer pcyes arkeum black vulcan rainbow switch blue 75 abnt2 preto cinza laranja akbv75bbr,219.99,,,BRL,,retailer_offer,,,,,,https://www.terabyteshop.com.br/produto/40605/teclado-mecanico-gamer-pcyes-arkeum-black-vulcan-rainbow-switch-blue-75-abnt2-preto-cinza-e-laranja-akbv75bbr,https://img.terabyteshop.com.br/produto/m/teclado-mecanico-gamer-pcyes-arkeum-black-vulcan-rainbow-switch-blue-75-abnt2-preto-cinza-e-laranja-akbv75bbr_263021.jpg,False,False,False,2026-05-02,2026-05-02 12:56:54.963 -0300,market_web_listings_raw_202605041156.csv,b6b98efb-d23f-4975-8fd6-748443dacccc
terabyte,teclado gamer,teclado,"Teclado Mecânico Gamer PCYes Arkeum Summit Edition, 75%, Switch Red, ABNT2, Branco e Azul, AKSM75RBR",teclado mecanico gamer pcyes arkeum summit edition 75 switch red abnt2 branco azul aksm75rbr,219.99,,,BRL,,retailer_offer,,,,,,https://www.terabyteshop.com.br/produto/41137/teclado-mecanico-gamer-pcyes-arkeum-summit-edition-75-switch-red-abnt2-branco-e-azul-aksm75rbr,https://img.terabyteshop.com.br/produto/m/teclado-mecanico-gamer-pcyes-arkeum-summit-edition-75-switch-red-abnt2-branco-e-azul-aksm75rbr_266813.jpg,False,False,False,2026-05-02,2026-05-02 12:56:54.963 -0300,market_web_listings_raw_202605041156.csv,35a08584-6078-4a17-bde1-55e6233a25a6
terabyte,teclado gamer,teclado,"Teclado Mecânico Gamer PCYes Arkeum Sunset Edition, 75%, Switch Blue, ABNT2, Azul, Amarelo e Roxo, AKSS75BBR",teclado mecanico gamer pcyes arkeum sunset edition 75 switch blue abnt2 azul amarelo roxo akss75bbr,219.99,,,BRL,,retailer_offer,,,,,,https://www.terabyteshop.com.br/produto/41138/teclado-mecanico-gamer-pcyes-arkeum-sunset-edition-75-switch-blue-abnt2-azul-amarelo-e-roxo-akss75bbr,https://img.terabyteshop.com.br/produto/m/teclado-mecanico-gamer-pcyes-arkeum-sunset-edition-75-switch-blue-abnt2-azul-amarelo-e-roxo-akss75bbr_266847.jpg,False,False,False,2026-05-02,2026-05-02 12:56:54.963 -0300,market_web_listings_raw_202605041156.csv,e47f5d83-aace-48c1-8873-b122df650099
terabyte,teclado gamer,teclado,"Teclado Mecânico Gamer PCYes Arkeum Sunset Edition, 75%, Switch Red, ABNT2, Azul, Amarelo e Roxo, AKSS75RBR",teclado mecanico gamer pcyes arkeum sunset edition 75 switch red abnt2 azul amarelo roxo akss75rbr,219.99,,,BRL,,retailer_offer,,,,,,https://www.terabyteshop.com.br/produto/41139/teclado-mecanico-gamer-pcyes-arkeum-sunset-edition-75-switch-red-abnt2-azul-amarelo-e-roxo-akss75rbr,https://img.terabyteshop.com.br/produto/m/teclado-mecanico-gamer-pcyes-arkeum-sunset-edition-75-switch-red-abnt2-azul-amarelo-e-roxo-akss75rbr_266863.jpg,False,False,False,2026-05-02,2026-05-02 12:56:54.963 -0300,market_web_listings_raw_202605041156.csv,441b994c-a989-4c6a-beaa-2958cf7dfb9c
terabyte,teclado gamer,teclado,"Teclado Magnético Gamer Madlions MAD68HE, RGB, Switch Magnetic Amber Pro, ANSI, Preto",teclado magnetico gamer madlions mad68he rgb switch magnetic amber pro ansi preto,329.99,,,BRL,,retailer_offer,,,,,,https://www.terabyteshop.com.br/produto/41468/teclado-magnetico-gamer-madlions-mad68he-rgb-switch-magnetic-amber-pro-ansi-preto,https://img.terabyteshop.com.br/produto/m/teclado-magnetico-gamer-madlions-mad68he-rgb-switch-magnetic-amber-pro-ansi-preto_267635.jpg,False,False,False,2026-05-02,2026-05-02 12:56:54.963 -0300,market_web_listings_raw_202605041156.csv,1077a88d-2fbd-4c65-9449-39b767bf01c6
terabyte,teclado gamer,teclado,"Teclado Magnético Gamer Madlions MAD68HE, RGB, Switch Magnetic Amber Pro, ANSI, Branco",teclado magnetico gamer madlions mad68he rgb switch magnetic amber pro ansi branco,329.99,,,BRL,,retailer_offer,,,,,,https://www.terabyteshop.com.br/produto/41470/teclado-magnetico-gamer-madlions-mad68he-rgb-switch-magnetic-amber-pro-ansi-branco,https://img.terabyteshop.com.br/produto/m/teclado-magnetico-gamer-madlions-mad68he-rgb-switch-magnetic-amber-pro-ansi-branco_267639.jpg,False,False,False,2026-05-02,2026-05-02 12:56:54.963 -0300,market_web_listings_raw_202605041156.csv,701f0326-5d80-457e-beeb-6d56dfc018fa
terabyte,teclado gamer,teclado,"Teclado Magnético Gamer Madlions NANO68 Pro, RGB, Switch Gateron Jade Esport Pro, ANSI, Branco/Roxo",teclado magnetico gamer madlions nano68 pro rgb switch gateron jade esport pro ansi branco roxo,559.99,,,BRL,,retailer_offer,,,,,,https://www.terabyteshop.com.br/produto/41476/teclado-magnetico-gamer-madlions-nano68-pro-rgb-switch-gateron-jade-esport-pro-ansi-brancoroxo,https://img.terabyteshop.com.br/produto/m/teclado-magnetico-gamer-madlions-nano68-pro-rgb-switch-gateron-jade-esport-pro-ansi-brancoroxo_267653.jpg,False,False,False,2026-05-02,2026-05-02 12:56:54.963 -0300,market_web_listings_raw_202605041156.csv,e592d034-630c-4d63-956c-9506cca224e3
terabyte,combo teclado mouse,mousepad,"MousePad Gamer Round5 Slide Vasco, Extra Grande, 900x400mm, Estampado",mousepad gamer round5 slide vasco extra grande 900x400mm estampado,79.99,,,BRL,,retailer_offer,,,,,,https://www.terabyteshop.com.br/produto/41246/mousepad-gamer-round5-slide-vasco-extra-grande-900x400mm-estampado,https://img.terabyteshop.com.br/produto/m/mousepad-gamer-round5-slide-vasco-extra-grande-900x400mm-estampado_266552.jpg,False,False,False,2026-05-02,2026-05-02 12:57:13.424 -0300,market_web_listings_raw_202605041156.csv,0b6cde9a-6510-490c-abbf-95c41d8425bc
terabyte,combo teclado mouse,mousepad,"Mousepad Gamer Force One Skyhawk Nightmare, XXL (900mm X 400mm x 3mm), Preto e Branco",mousepad gamer force one skyhawk nightmare xxl 900mm x 400mm x 3mm preto branco,69.99,,,BRL,,retailer_offer,,,,,,https://www.terabyteshop.com.br/produto/40895/mousepad-gamer-force-one-skyhawk-nightmare-xxl-900mm-x-400mm-x-3mm-preto-e-branco,https://img.terabyteshop.com.br/produto/m/mousepad-gamer-force-one-skyhawk-nightmare-xxl-900mm-x-400mm-x-3mm-preto-e-branco_264757.jpg,False,False,False,2026-05-02,2026-05-02 12:57:13.424 -0300,market_web_listings_raw_202605041156.csv,0a2e98b8-99e2-44eb-adce-33040b72965d
amazon,combo teclado mouse,mouse,"Combo de Teclado e Mouse Ergonômico Sem Fio HP 230 - com Dongle USB Wireless, Digitação Silenciosa, Design Elegante, Até 12 Meses de Bateria, Layout BR, Preto (18H24AA#AC4)",combo teclado mouse ergonomico sem fio hp 230 dongle usb wireless digitacao silenciosa design elegante ate 12 meses,129.99,,,BRL,,bsr_or_reviews_proxy,1000.00,2.0,1000,,"Combo de Teclado e Mouse Ergonômico Sem Fio HP 230 - com Dongle USB Wireless, Digitação Silenciosa, Design Elegante, Até 12 Meses de Bateria, Layout BR, Preto (18H24AA#AC4) 4,7 4,7 de 5 estrelas (1 mil) R$ 129,99 R$129 , 99 R$ 164,90 R$164,90 à vista no Pix ou NuPay Limite Adicional ou em até 5x de R$ 30,58 R$30,58 sem juros Entrega GRÁTIS: Amanhã, 3 de mai. no seu primeiro pedido Ou entrega mais rápida: Amanhã 07:00 - 10:59 Adicionar ao carrinho",https://www.amazon.com.br/dp/B0CVNMR68Z,https://m.media-amazon.com/images/I/71MW8ZR1vUL._AC_UL320_.jpg,False,True,False,2026-05-03,2026-05-02 23:02:38.766 -0300,market_web_listings_raw_202605041156.csv,ba381fc0-723b-4332-8659-de308e5c0276
amazon,combo teclado mouse,mouse,Kit Teclado e Mouse sem Fio Multi 2.4GHz USB Multi Preto -TC269,kit teclado mouse sem fio multi 2 4ghz usb multi preto tc269,89.90,,,BRL,50,bsr_or_reviews_proxy,50.00,2.4,102,,"Kit Teclado e Mouse sem Fio Multi 2.4GHz USB Multi Preto -TC269 4,3 4,3 de 5 estrelas (102) Mais de 50 compras no mês passado Preço, página do produto R$ 89,90 R$89 , 90 De: R$ 109,90 De: R$ 109,90 R$109,90 em até 2x de R$ 44,95 R$44,95 sem juros Entrega GRÁTIS: Hoje no seu primeiro pedido Adicionar ao carrinho",https://www.amazon.com.br/dp/B098697HG1,https://m.media-amazon.com/images/I/51BNfSJfevL._AC_UL320_.jpg,False,True,False,2026-05-02,2026-05-02 12:57:05.491 -0300,market_web_listings_raw_202605041156.csv,fa2b521b-33f3-45d6-a91d-8e611643f6ba
amazon,combo teclado mouse,mouse,"Combo Teclado e Mouse sem fio Logitech POP Icon com Teclas e Botões Personalizáveis, Clique Silencioso, Easy-Switch para até 3 dispositivos e Conexão Bluetooth - Branco",combo teclado mouse sem fio logitech pop icon teclas botoes personalizaveis clique silencioso easy switch ate 3 dispositivos,329.90,,,BRL,,bsr_or_reviews_proxy,204.00,3.0,204,,"Combo Teclado e Mouse sem fio Logitech POP Icon com Teclas e Botões Personalizáveis, Clique Silencioso, Easy-Switch para até 3 dispositivos e Conexão Bluetooth - Branco 4,7 4,7 de 5 estrelas (204) R$ 329,90 R$329 , 90 R$ 499,90 R$499,90 à vista ou em até 7x de R$ 55,44 R$55,44 sem juros Entrega GRÁTIS: Amanhã, 4 de mai. no seu primeiro pedido Somente 9 em estoque. Adicionar ao carrinho",https://www.amazon.com.br/dp/B0DPXZJ9G4,https://m.media-amazon.com/images/I/51ZiiNAvukL._AC_UL320_.jpg,False,True,False,2026-05-03,2026-05-03 01:03:02.197 -0300,market_web_listings_raw_202605041156.csv,a87df5b3-1b1e-4d25-872f-a04db5c3aa76
amazon,combo teclado mouse,mouse,"Combo Teclado e Mouse sem fio Logitech POP Icon com Teclas e Botões Personalizáveis, Clique Silencioso, Easy-Switch para até 3 dispositivos e Conexão Bluetooth - Grafite",combo teclado mouse sem fio logitech pop icon teclas botoes personalizaveis clique silencioso easy switch ate 3 dispositivos,349.00,,,BRL,50,bsr_or_reviews_proxy,50.00,3.0,205,,"Combo Teclado e Mouse sem fio Logitech POP Icon com Teclas e Botões Personalizáveis, Clique Silencioso, Easy-Switch para até 3 dispositivos e Conexão Bluetooth - Grafite 4,7 4,7 de 5 estrelas (205) Mais de 50 compras no mês passado Ofertas 5.5 Preço, página do produto R$ 349,00 R$349 , 00 De: R$ 499,90 De: R$ 499,90 R$499,90 em até 6x de R$ 58,16 R$58,16 sem juros Promoção disponível de 10% off Entrega GRÁTIS: Amanhã, 4 de mai. no seu primeiro pedido Adicionar ao carrinho",https://www.amazon.com.br/dp/B0DPXZ6H24,https://m.media-amazon.com/images/I/71bpua-bVsL._AC_UL320_.jpg,False,True,False,2026-05-03,2026-05-03 11:03:43.445 -0300,market_web_listings_raw_202605041156.csv,f8adce35-4a18-4386-90cb-e9de6932d370
amazon,combo teclado mouse,mouse,Combo Teclado e Mouse sem Fio Bluetooth Ultrafino e Recarregável para Tablets e Celulares Compatível com Windows/Mac/Android Para Lite P610 Tab S6 - Preto,combo teclado mouse sem fio bluetooth ultrafino recarregavel tablets celulares compativel windows mac android lite p610 tab s6,52.90,,,BRL,50,bsr_or_reviews_proxy,50.00,1.0,49,,"Combo Teclado e Mouse sem Fio Bluetooth Ultrafino e Recarregável para Tablets e Celulares Compatível com Windows/Mac/Android Para Lite P610 Tab S6 - Preto 4,3 4,3 de 5 estrelas (49) Mais de 50 compras no mês passado Preço, página do produto R$ 52,90 R$52 , 90 em até 2x de R$ 26,45 R$26,45 sem juros Mais por Menos: 5% off em 5+ itens Entrega GRÁTIS: Hoje no seu primeiro pedido Adicionar ao carrinho",https://www.amazon.com.br/dp/B0FFP6ZFGF,https://m.media-amazon.com/images/I/51QG8GxWaZL._AC_UL320_.jpg,False,True,False,2026-05-02,2026-05-02 12:57:05.491 -0300,market_web_listings_raw_202605041156.csv,df1e36d8-a246-4b4e-87db-a59578ce14d1
amazon,combo teclado mouse,mouse,Teclado e mouse sem fio Dell Pro — KM5221W Branco,teclado mouse sem fio dell pro km5221w branco,209.00,,,BRL,300,bsr_or_reviews_proxy,300.00,5.0,6700,,"Teclado e mouse sem fio Dell Pro — KM5221W Branco 4,7 4,7 de 5 estrelas (6,7 mil) Mais de 300 compras no mês passado Preço, página do produto R$ 209,00 R$209 , 00 De: R$ 223,00 De: R$ 223,00 R$223,00 em até 6x de R$ 34,83 R$34,83 sem juros 90 dias de Amazon Music grátis incluso Entrega GRÁTIS: Hoje no seu primeiro pedido Ou entrega mais rápida: Hoje 16:00 - 18:59 Adicionar ao carrinho",https://www.amazon.com.br/dp/B09QQNF3F7,https://m.media-amazon.com/images/I/51p33zP9N-L._AC_UL320_.jpg,False,True,False,2026-05-02,2026-05-02 12:57:05.491 -0300,market_web_listings_raw_202605041156.csv,e57a5e49-3c62-46ce-b4f3-97620286f564
terabyte,combo teclado mouse,mousepad,Mousepad Redragon Harry Potter Gryffindor 900x400mm,mousepad redragon harry potter gryffindor 900x400mm,119.99,,,BRL,,retailer_offer,,,,,,https://www.terabyteshop.com.br/produto/39079/mousepad-gamer-redragon-harry-potter-gryffindor-special-edition-speed-extra-grande-900x400mm-vermelho-hp-939,https://img.terabyteshop.com.br/produto/m/mousepad-gamer-redragon-harry-potter-gryffindor-special-edition-speed-extra-grande-900x400mm-vermelho-hp-939_254634.jpg,False,False,False,2026-05-02,2026-05-02 12:57:13.424 -0300,market_web_listings_raw_202605041156.csv,056361db-01aa-49dc-be02-303740db80da
terabyte,combo teclado mouse,mousepad,Mousepad Gamer Vinik Extended Level Up 700x400mm,mousepad gamer vinik extended level up 700x400mm,39.99,,,BRL,,retailer_offer,,,,,,https://www.terabyteshop.com.br/produto/34148/mousepad-gamer-vinik-extended-level-up-grande-700x400mm-mpxlu74,https://img.terabyteshop.com.br/produto/m/mousepad-gamer-vinik-extended-level-up-grande-700x400mm-mpxlu74_227156.jpg,False,False,False,2026-05-02,2026-05-02 12:57:13.424 -0300,market_web_listings_raw_202605041156.csv,95dfebe2-3328-46cd-b311-a2390a796aeb
terabyte,combo teclado mouse,mouse,"Suporte Para Teclado e Mouse Thermaltake, Compatível Com Cockpit GR500 e GF500, Branco, GSC-ACC-KBASWH-01",suporte teclado mouse thermaltake compativel cockpit gr500 gf500 branco gsc acc kbaswh 01,839.99,,,BRL,,retailer_offer,,,,,,https://www.terabyteshop.com.br/produto/40474/suporte-para-teclado-e-mouse-thermaltake-compativel-com-cockpit-gr500-e-gf500-branco-gsc-acc-kbaswh-01,https://img.terabyteshop.com.br/produto/m/suporte-para-teclado-e-mouse-thermaltake-compativel-com-cockpit-gr500-e-gf500-branco-gsc-acc-kbaswh-01_262178.jpg,False,False,False,2026-05-02,2026-05-02 12:57:13.424 -0300,market_web_listings_raw_202605041156.csv,976a1d91-16f0-4f40-941c-063c37890a2c
