source_name,query,category,title,title_key,price,old_price,discount_pct,currency_id,sold_quantity,demand_signal_type,demand_signal_value,rating,reviews_count,seller_text,shipping_text,item_url,image_url,is_sponsored,is_full,is_catalog,fetched_date,fetched_at,source_file,source_record_id
terabyte,teclado mecanico,teclado,Teclado Mecânico Corsair K70 RGB PRO Cherry MX Red,teclado mecanico corsair k70 rgb pro cherry mx red,88.24,,,BRL,,retailer_offer,,,,,"Teclado Mecânico Corsair K70 RGB PRO Cherry MX Red | Terabyte R$ 899,99 12x de R$ 88,24 sem juros 🔥 em promoção Frete Grátis Periféricos > Teclado",https://www.terabyteshop.com.br/produto/39935/teclado-mecanico-gamer-corsair-k70-rgb-pro-switch-cherry-mx-red-ansi-preto-ch-9109410-na,https://img.terabyteshop.com.br/produto/m/teclado-mecanico-gamer-corsair-k70-rgb-pro-switch-cherry-mx-red-ansi-preto-ch-9109410-na_258354.jpg,False,False,False,2026-05-02,2026-05-02 04:43:53.980 -0300,market_web_listings_raw_202605041156.csv,08389d9d-35e5-4e8a-b31f-3e3509f2550b
terabyte,teclado mecanico,teclado,Teclado Mecânico Fortrek Gravity 65 Outemu Red,teclado mecanico fortrek gravity 65 outemu red,129.99,,,BRL,,retailer_offer,,,,,,https://www.terabyteshop.com.br/produto/33907/teclado-gamer-mecanico-fortrek-gravity-65-rainbow-switch-outemu-red-abnt2-compact-preto,https://img.terabyteshop.com.br/produto/m/teclado-gamer-mecanico-fortrek-gravity-65-rainbow-switch-outemu-red-abnt2-compact-preto_225569.jpg,False,False,False,2026-05-02,2026-05-02 04:43:53.980 -0300,market_web_listings_raw_202605041156.csv,eb531044-7ec7-4bab-ada4-2489135d48bf
terabyte,teclado mecanico,teclado,Teclado Mecânico Corsair K70 Core TKL RGB Wireless,teclado mecanico corsair k70 core tkl rgb wireless,94.12,,,BRL,,retailer_offer,,,,,"Teclado Mecânico Corsair K70 Core TKL RGB Wireless | Terabyte R$ 959,99 12x de R$ 94,12 sem juros 🔥 em promoção Frete Grátis Periféricos > Teclado",https://www.terabyteshop.com.br/produto/39782/teclado-gamer-mecanico-corsair-k70-core-tkl-rgb-wireless-switch-mlx-red-ansi-preto-ch-914901e-na,https://img.terabyteshop.com.br/produto/m/teclado-gamer-mecanico-corsair-k70-core-tkl-rgb-wireless-switch-mlx-red-ansi-preto-ch-914901e-na_257301.jpg,False,False,False,2026-05-02,2026-05-02 04:43:53.980 -0300,market_web_listings_raw_202605041156.csv,5053b584-c72f-4fc9-8d25-c4033bf7e9d0
terabyte,teclado mecanico,teclado,Teclado Mecânico Akko 3061s RGB 60% ABNT2 Pink,teclado mecanico akko 3061s rgb 60 abnt2 pink,299.99,,,BRL,,retailer_offer,,,,,,https://www.terabyteshop.com.br/produto/35958/teclado-gamer-mecanico-akko-3061s-rgb-60-abnt2-switch-akko-pink,https://img.terabyteshop.com.br/produto/m/teclado-gamer-mecanico-akko-3061s-rgb-60-abnt2-switch-akko-pink_237123.png,False,False,False,2026-05-02,2026-05-02 04:43:53.980 -0300,market_web_listings_raw_202605041156.csv,c9f4bb40-5595-4965-b079-b9987b0485bf
terabyte,teclado mecanico,teclado,Teclado Mecânico Machenike KG87 RGB TKL Switch Silver,teclado mecanico machenike kg87 rgb tkl switch silver,299.99,,,BRL,,retailer_offer,,,,,,https://www.terabyteshop.com.br/produto/41670/teclado-mecanico-gamer-machenike-kg87-rgb-tkl-ansi-switch-silver-cinza-preto-e-verde-jj02gc00j,https://img.terabyteshop.com.br/produto/m/teclado-mecanico-gamer-machenike-kg87-rgb-tkl-ansi-switch-silver-cinza-preto-e-verde-jj02gc00j_269822.jpg,False,False,False,2026-05-02,2026-05-02 04:43:53.980 -0300,market_web_listings_raw_202605041156.csv,2f97e499-939d-4132-920c-f31bf2a9a0aa
terabyte,teclado mecanico,teclado,Teclado Mecânico Cooler Master MK770 RGB Wireless,teclado mecanico cooler master mk770 rgb wireless,609.99,,,BRL,,retailer_offer,,,,,,https://www.terabyteshop.com.br/produto/28406/teclado-mecanico-gamer-cooler-master-mk770-macaron-wirelessbluetooth-rgb-ansi-switch-kailh-box-v2-white-mk-770-mckw1-us,https://img.terabyteshop.com.br/produto/m/teclado-mecanico-gamer-cooler-master-mk770-macaron-wirelessbluetooth-rgb-ansi-switch-kailh-box-v2-white-mk-770-mckw1-us_193308.jpg,False,False,False,2026-05-02,2026-05-02 04:43:53.980 -0300,market_web_listings_raw_202605041156.csv,85551f59-65eb-438b-b5cc-f7bda7538c34
terabyte,teclado mecanico,teclado,"Teclado Gamer Mecânico Evolut EG222/RYZ, Low Profile, RGB, Switch Red, ABNT2, Preto",teclado gamer mecanico evolut eg222 ryz low profile rgb switch red abnt2 preto,139.99,,,BRL,,retailer_offer,,,,,,https://www.terabyteshop.com.br/produto/41291/teclado-gamer-mecanico-evolut-eg222ryz-low-profile-rgb-switch-red-abnt2-preto,https://img.terabyteshop.com.br/produto/m/teclado-gamer-mecanico-evolut-eg222ryz-low-profile-rgb-switch-red-abnt2-preto_266768.jpg,False,False,False,2026-05-02,2026-05-02 04:43:53.980 -0300,market_web_listings_raw_202605041156.csv,b18c1342-f5e1-4079-a705-15d6e5755683
terabyte,teclado mecanico,teclado,Teclado Mecânico Force One Atlas 60% RGB Switch Red,teclado mecanico force one atlas 60 rgb switch red,159.99,,,BRL,,retailer_offer,,,,,,https://www.terabyteshop.com.br/produto/27578/teclado-mecanico-gamer-force-one-atlas-60-rgb-switch-red-white-frtca601,https://img.terabyteshop.com.br/produto/m/teclado-mecanico-gamer-force-one-atlas-60-rgb-switch-red-white-frtca601_187810.png,False,False,False,2026-05-02,2026-05-02 04:43:53.980 -0300,market_web_listings_raw_202605041156.csv,6b78708e-43e4-4383-95b2-4a81647ea03c
terabyte,teclado mecanico,teclado,Base Teclado Mecânico Devarajas Barebone RGB RD-BBK556,base teclado mecanico devarajas barebone rgb rd bbk556,309.99,,,BRL,,retailer_offer,,,,,,https://www.terabyteshop.com.br/produto/25061/base-para-teclado-mecanico-gamer-devarajas-barebore-rgb-black-rd-bbk556,https://img.terabyteshop.com.br/produto/m/base-para-teclado-mecanico-gamer-devarajas-barebore-rgb-black-rd-bbk556_170807.jpg,False,False,False,2026-05-02,2026-05-02 04:43:53.980 -0300,market_web_listings_raw_202605041156.csv,3db1861e-9f24-4fde-8d4d-612115ab9781
terabyte,teclado mecanico,teclado,Teclado Mecânico SuperFrame Phantom RGB Wireless ABNT2,teclado mecanico superframe phantom rgb wireless abnt2,309.99,,,BRL,,retailer_offer,,,,,,https://www.terabyteshop.com.br/produto/37212/teclado-mecanico-gamer-superframe-phantom-rgb-wirelessbluetooth-switch-ktt-winered-linear-abnt2-branco-sf-kb-gtktfswrtab,https://img.terabyteshop.com.br/produto/m/teclado-mecanico-gamer-superframe-phantom-rgb-wirelessbluetooth-switch-ktt-winered-linear-abnt2-branco-sf-kb-gtktfswrtab_260668.jpg,False,False,False,2026-05-02,2026-05-02 04:43:53.980 -0300,market_web_listings_raw_202605041156.csv,cdc8d40e-e189-4675-9ba1-5f852cfd4003
terabyte,teclado mecanico,teclado,Teclado Mecânico Ajazz AKP815 LCD RGB 75% Tea,teclado mecanico ajazz akp815 lcd rgb 75 tea,95.10,,,BRL,,retailer_offer,,,,,,https://www.terabyteshop.com.br/produto/36193/teclado-mecanico-gamer-ajazz-akp815-com-display-lcd-rgb-usb-ansi-75-switch-huannuo-short-tea-branco-azul-e-laranja,https://img.terabyteshop.com.br/produto/m/teclado-mecanico-gamer-ajazz-akp815-com-display-lcd-rgb-usb-ansi-75-switch-huannuo-short-tea-branco-azul-e-laranja_238280.jpg,False,False,False,2026-05-02,2026-05-02 04:43:53.980 -0300,market_web_listings_raw_202605041156.csv,9393c3b4-2b53-457d-9e6a-6ddf76eca5e0
terabyte,teclado mecanico,teclado,"Teclado Mecânico Gamer PCYes Mecka Black Vulcan, Rainbow, Switch Outemu Red, 65%, ABNT2, Preto e Cinza, TPMKBVRD",teclado mecanico gamer pcyes mecka black vulcan rainbow switch outemu red 65 abnt2 preto cinza tpmkbvrd,169.99,,,BRL,,retailer_offer,,,,,,https://www.terabyteshop.com.br/produto/41132/teclado-mecanico-gamer-pcyes-mecka-black-vulcan-rainbow-switch-outemu-red-65-abnt2-preto-e-cinza-tpmkbvrd,https://img.terabyteshop.com.br/produto/m/teclado-mecanico-gamer-pcyes-mecka-black-vulcan-rainbow-switch-outemu-red-65-abnt2-preto-e-cinza-tpmkbvrd_266781.jpg,False,False,False,2026-05-02,2026-05-02 04:43:53.980 -0300,market_web_listings_raw_202605041156.csv,647b1ccf-67c5-4d7b-8dec-a5f9a3d9faf4
terabyte,teclado mecanico,teclado,"Teclado Mecânico Gamer PCYes Shiyan Black Vulcan, RGB, Switch Outemu Blue, 60%, ABNT2, Preto, TPSHBVBL",teclado mecanico gamer pcyes shiyan black vulcan rgb switch outemu blue 60 abnt2 preto tpshbvbl,189.99,,,BRL,,retailer_offer,,,,,,https://www.terabyteshop.com.br/produto/41127/teclado-mecanico-gamer-pcyes-shiyan-black-vulcan-rgb-switch-outemu-blue-60-abnt2-preto-tpshbvbl,https://img.terabyteshop.com.br/produto/m/teclado-mecanico-gamer-pcyes-shiyan-black-vulcan-rgb-switch-outemu-blue-60-abnt2-preto-tpshbvbl_266750.jpg,False,False,False,2026-05-02,2026-05-02 04:43:53.980 -0300,market_web_listings_raw_202605041156.csv,518d0266-3cc3-416c-9261-accd04f42e8a
terabyte,teclado gamer,teclado,Teclado Mecânico Gamer Ninja Leap Pudim Blue White,teclado mecanico gamer ninja leap pudim blue white,79.99,,,BRL,,retailer_offer,,,,,,https://www.terabyteshop.com.br/produto/23652/teclado-mecanico-gamer-ninja-leap-pudim-switch-blue-rgb-rainbow-abnt2-white,https://img.terabyteshop.com.br/produto/m/teclado-mecanico-gamer-ninja-leap-pudim-switch-blue-rgb-rainbow-abnt2-white_161062.png,False,False,False,2026-05-02,2026-05-02 04:44:06.185 -0300,market_web_listings_raw_202605041156.csv,d0a2d9bc-f5f9-42a6-8699-b797ec09b5ab
terabyte,teclado gamer,teclado,"Teclado Gamer Mecânico Evolut EG275/CLASS, 75%, RGB, Switch Brown, ABNT2, Preto",teclado gamer mecanico evolut eg275 class 75 rgb switch brown abnt2 preto,149.99,,,BRL,,retailer_offer,,,,,"Teclado Gamer Mecânico Evolut EG275/CLASS, 75%, RGB, Switch Brown, ABNT2, Preto De: R$ 176,46 R$ 149,99 12x de R$ 14,71 sem juros 🔥 em promoção Frete Grátis Periféricos > Teclado",https://www.terabyteshop.com.br/produto/41292/teclado-gamer-mecanico-evolut-eg275class-75-rgb-switch-brown-abnt2-preto,https://img.terabyteshop.com.br/produto/m/teclado-gamer-mecanico-evolut-eg275class-75-rgb-switch-brown-abnt2-preto_266771.jpg,False,False,False,2026-05-02,2026-05-02 04:44:06.185 -0300,market_web_listings_raw_202605041156.csv,463f0651-2714-4a6f-9647-b9e796116e5b
terabyte,teclado gamer,teclado,Teclado Gamer Ninja Black Noir RGB Membrana ABNT2,teclado gamer ninja black noir rgb membrana abnt2,49.99,,,BRL,,retailer_offer,,,,,,https://www.terabyteshop.com.br/produto/22092/teclado-gamer-ninja-black-noir-rgb-switch-membrana-abnt2-black-tc-gn-bknr,https://img.terabyteshop.com.br/produto/m/teclado-gamer-ninja-black-noir-rgb-switch-membrana-abnt2-black-tc-gn-bknr_148766.png,False,False,False,2026-05-02,2026-05-02 04:44:06.185 -0300,market_web_listings_raw_202605041156.csv,7ccba432-4b5f-4c08-8eda-a9dfedd7a815
terabyte,teclado gamer,teclado,"Teclado Magnético Gamer Madlions MAD60HE, RGB, Switch Magnetic Amber Pro, 65%, ANSI, Preto",teclado magnetico gamer madlions mad60he rgb switch magnetic amber pro 65 ansi preto,199.99,,,BRL,,retailer_offer,,,,,,https://www.terabyteshop.com.br/produto/41464/teclado-magnetico-gamer-madlions-mad60he-rgb-switch-magnetic-amber-pro-65-ansi-preto,https://img.terabyteshop.com.br/produto/m/teclado-magnetico-gamer-madlions-mad60he-rgb-switch-magnetic-amber-pro-65-ansi-preto_267607.jpg,False,False,False,2026-05-02,2026-05-02 04:44:06.185 -0300,market_web_listings_raw_202605041156.csv,14126293-8673-43d0-8d7e-1887ffe53175
terabyte,teclado gamer,teclado,"Teclado Magnético Gamer Madlions MAD60HE, RGB, Switch Magnetic Amber Pro, 60%, ANSI, Branco",teclado magnetico gamer madlions mad60he rgb switch magnetic amber pro 60 ansi branco,199.99,,,BRL,,retailer_offer,,,,,,https://www.terabyteshop.com.br/produto/41465/teclado-magnetico-gamer-madlions-mad60he-rgb-switch-magnetic-amber-pro-65-ansi-branco,https://img.terabyteshop.com.br/produto/m/teclado-magnetico-gamer-madlions-mad60he-rgb-switch-magnetic-amber-pro-65-ansi-branco_267617.jpg,False,False,False,2026-05-02,2026-05-02 04:44:06.185 -0300,market_web_listings_raw_202605041156.csv,045a7bd0-dd80-42b5-ba29-09e4277ae381
terabyte,teclado gamer,teclado,Teclado Gamer Corsair K55 Core TKL Membrana RGB,teclado gamer corsair k55 core tkl membrana rgb,309.99,,,BRL,,retailer_offer,,,,,"Teclado Gamer Corsair K55 Core TKL Membrana RGB | Terabyte De: R$ 364,69 R$ 309,99 12x de R$ 30,40 sem juros 🔥 em promoção Frete Grátis Periféricos > Teclado",https://www.terabyteshop.com.br/produto/40036/teclado-gamer-corsair-k55-core-tkl-membrana-rgb-ansi-usb-preto-ch-9216065-na,https://img.terabyteshop.com.br/produto/m/teclado-gamer-corsair-k55-core-tkl-membrana-rgb-ansi-usb-preto-ch-9216065-na_259243.jpg,False,False,False,2026-05-02,2026-05-02 04:44:06.185 -0300,market_web_listings_raw_202605041156.csv,6a922e21-d04a-4dc5-8c4d-0c4b0cd488c1
terabyte,teclado gamer,teclado,"Teclado Magnético Gamer Madlions MAD60HE V2 Flagship, RGB, Switch Magnetic Gamer, 60%, ANSI, Preto",teclado magnetico gamer madlions mad60he v2 flagship rgb switch magnetic gamer 60 ansi preto,299.99,,,BRL,,retailer_offer,,,,,,https://www.terabyteshop.com.br/produto/41467/teclado-magnetico-gamer-madlions-mad60he-v2-flagship-rgb-switch-magneto-gamer-60-ansi-preto,https://img.terabyteshop.com.br/produto/m/teclado-magnetico-gamer-madlions-mad60he-v2-flagship-rgb-switch-magneto-gamer-60-ansi-preto_269267.png,False,False,False,2026-05-02,2026-05-02 04:44:06.185 -0300,market_web_listings_raw_202605041156.csv,777c3e11-e0e8-4e05-aff9-d6ab20b72bf6
terabyte,teclado gamer,teclado,"Teclado Magnético Gamer ATK Edge 60HE Leviatan, RGB, Switch TTC RGB Magneto, 60%, ANSI, Branco",teclado magnetico gamer atk edge 60he leviatan rgb switch ttc rgb magneto 60 ansi branco,98.04,,,BRL,,retailer_offer,,,,,,https://www.terabyteshop.com.br/produto/41392/teclado-magnetico-gamer-atk-edge-60he-leviatan-rgb-switch-ttc-rgb-magneto-60-ansi-branco,https://img.terabyteshop.com.br/produto/m/teclado-magnetico-gamer-atk-edge-60he-leviatan-rgb-switch-ttc-rgb-magneto-60-ansi-branco_267358.jpg,False,False,False,2026-05-02,2026-05-02 04:44:06.185 -0300,market_web_listings_raw_202605041156.csv,6d37bfc1-994a-4443-9673-8b7041d0eefe
terabyte,teclado gamer,teclado,"Teclado Gamer Evolut Fay, 60%, Rainbow, Membrana, ABNT2, Preto, EG-211",teclado gamer evolut fay 60 rainbow membrana abnt2 preto eg 211,69.99,,,BRL,,retailer_offer,,,,,,https://www.terabyteshop.com.br/produto/41290/teclado-gamer-evolut-fay-60-rainbow-membrana-abnt2-preto-eg-211,https://img.terabyteshop.com.br/produto/m/teclado-gamer-evolut-fay-60-rainbow-membrana-abnt2-preto-eg-211_266757.jpg,False,False,False,2026-05-02,2026-05-02 04:44:06.185 -0300,market_web_listings_raw_202605041156.csv,afaf013b-8a8b-4331-aee2-7e38c1210dae
terabyte,teclado gamer,teclado,"Teclado Gamer Mecânico Evolut EG222/RYZ, Low Profile, RGB, Switch Red, ABNT2, Preto",teclado gamer mecanico evolut eg222 ryz low profile rgb switch red abnt2 preto,139.99,,,BRL,,retailer_offer,,,,,,https://www.terabyteshop.com.br/produto/41291/teclado-gamer-mecanico-evolut-eg222ryz-low-profile-rgb-switch-red-abnt2-preto,https://img.terabyteshop.com.br/produto/m/teclado-gamer-mecanico-evolut-eg222ryz-low-profile-rgb-switch-red-abnt2-preto_266768.jpg,False,False,False,2026-05-02,2026-05-02 04:44:06.185 -0300,market_web_listings_raw_202605041156.csv,17ebfcf2-414f-413c-9e7f-f9b37d3b6204
terabyte,teclado gamer,teclado,Teclado Gamer Fortrek Shortcut Rainbow Membrana ABNT2,teclado gamer fortrek shortcut rainbow membrana abnt2,59.99,,,BRL,,retailer_offer,,,,,,https://www.terabyteshop.com.br/produto/33911/teclado-gamer-fortrek-shortcut-rainbow-membrana-full-size-abnt2-preto,https://img.terabyteshop.com.br/produto/m/teclado-gamer-fortrek-shortcut-rainbow-membrana-full-size-abnt2-preto_225599.jpg,False,False,False,2026-05-02,2026-05-02 04:44:06.185 -0300,market_web_listings_raw_202605041156.csv,2f80cad0-436c-498f-9e8e-4f10ece7aee3
terabyte,teclado gamer,teclado,"Teclado Mecânico Gamer PCYes Mecka Black Vulcan, Rainbow, Switch Outemu Red, 65%, ABNT2, Preto e Cinza, TPMKBVRD",teclado mecanico gamer pcyes mecka black vulcan rainbow switch outemu red 65 abnt2 preto cinza tpmkbvrd,169.99,,,BRL,,retailer_offer,,,,,,https://www.terabyteshop.com.br/produto/41132/teclado-mecanico-gamer-pcyes-mecka-black-vulcan-rainbow-switch-outemu-red-65-abnt2-preto-e-cinza-tpmkbvrd,https://img.terabyteshop.com.br/produto/m/teclado-mecanico-gamer-pcyes-mecka-black-vulcan-rainbow-switch-outemu-red-65-abnt2-preto-e-cinza-tpmkbvrd_266781.jpg,False,False,False,2026-05-02,2026-05-02 04:44:06.185 -0300,market_web_listings_raw_202605041156.csv,e232c7ca-b1df-40b1-9057-0ce7a26ec04c
terabyte,teclado gamer,teclado,"Teclado Mecânico Gamer PCYes Shiyan Black Vulcan, RGB, Switch Outemu Blue, 60%, ABNT2, Preto, TPSHBVBL",teclado mecanico gamer pcyes shiyan black vulcan rgb switch outemu blue 60 abnt2 preto tpshbvbl,189.99,,,BRL,,retailer_offer,,,,,,https://www.terabyteshop.com.br/produto/41127/teclado-mecanico-gamer-pcyes-shiyan-black-vulcan-rgb-switch-outemu-blue-60-abnt2-preto-tpshbvbl,https://img.terabyteshop.com.br/produto/m/teclado-mecanico-gamer-pcyes-shiyan-black-vulcan-rgb-switch-outemu-blue-60-abnt2-preto-tpshbvbl_266750.jpg,False,False,False,2026-05-02,2026-05-02 04:44:06.185 -0300,market_web_listings_raw_202605041156.csv,f0858e02-e9b8-4a82-af5a-2c9f50bca715
terabyte,teclado gamer,teclado,"Teclado Mecânico Gamer PCYes Arkeum White Ghost, Rainbow, Switch Red, 75%, ABNT2, Branco, Cinza e Laranja, AKWG75RBR",teclado mecanico gamer pcyes arkeum white ghost rainbow switch red 75 abnt2 branco cinza laranja akwg75rbr,229.99,,,BRL,,retailer_offer,,,,,,https://www.terabyteshop.com.br/produto/40602/teclado-mecanico-gamer-pcyes-arkeum-white-ghost-rainbow-switch-red-75-abnt2-branco-cinza-e-laranja-akwg75rbr,https://img.terabyteshop.com.br/produto/m/teclado-mecanico-gamer-pcyes-arkeum-white-ghost-rainbow-switch-red-75-abnt2-branco-cinza-e-laranja-akwg75rbr_263003.jpg,False,False,False,2026-05-02,2026-05-02 04:44:06.185 -0300,market_web_listings_raw_202605041156.csv,d1b1a6b5-c381-400b-818e-ee03874daf67
terabyte,teclado gamer,teclado,"Teclado Mecânico Gamer PCYes Arkeum White Ghost, Rainbow, Switch Blue, 75%, ABNT2, Branco, Cinza e Laranja, AKWG75BBR",teclado mecanico gamer pcyes arkeum white ghost rainbow switch blue 75 abnt2 branco cinza laranja akwg75bbr,229.99,,,BRL,,retailer_offer,,,,,,https://www.terabyteshop.com.br/produto/40603/teclado-mecanico-gamer-pcyes-arkeum-white-ghost-rainbow-switch-blue-75-abnt2-branco-cinza-e-laranja-akwg75bbr,https://img.terabyteshop.com.br/produto/m/teclado-mecanico-gamer-pcyes-arkeum-white-ghost-rainbow-switch-blue-75-abnt2-branco-cinza-e-laranja-akwg75bbr_263012.jpg,False,False,False,2026-05-02,2026-05-02 04:44:06.185 -0300,market_web_listings_raw_202605041156.csv,c1515746-d9a1-47a6-a3b4-cede0cf8839f
terabyte,teclado gamer,teclado,"Teclado Magnético Gamer Madlions NANO68, RGB, Switch Magnetic Silver, ANSI, Branco/Roxo",teclado magnetico gamer madlions nano68 rgb switch magnetic silver ansi branco roxo,419.99,,,BRL,,retailer_offer,,,,,,https://www.terabyteshop.com.br/produto/41475/teclado-magnetico-gamer-madlions-nano68-rgb-switch-magnetic-silver-ansi-brancoroxo,https://img.terabyteshop.com.br/produto/m/teclado-magnetico-gamer-madlions-nano68-rgb-switch-magnetic-silver-ansi-brancoroxo_267652.jpg,False,False,False,2026-05-02,2026-05-02 04:44:06.185 -0300,market_web_listings_raw_202605041156.csv,4ac0ba0c-41e8-4275-b463-3402c2642c15
terabyte,teclado gamer,teclado,"Teclado Magnético Gamer Madlions MAD68 PRO, RGB, Switch Gateron Jade Custom, ANSI, Preto",teclado magnetico gamer madlions mad68 pro rgb switch gateron jade custom ansi preto,529.99,,,BRL,,retailer_offer,,,,,,https://www.terabyteshop.com.br/produto/41471/teclado-magnetico-gamer-madlions-mad68-pro-rgb-switch-gateron-jade-custom-ansi-preto,https://img.terabyteshop.com.br/produto/m/teclado-magnetico-gamer-madlions-mad68-pro-rgb-switch-gateron-jade-custom-ansi-preto_267642.jpg,False,False,False,2026-05-02,2026-05-02 04:44:06.185 -0300,market_web_listings_raw_202605041156.csv,47737b65-1784-4b8a-8e91-945f0b8a7436
terabyte,teclado gamer,teclado,"Teclado Magnético Gamer Madlions MAD68 PRO, RGB, Switch Gateron Jade Esport Pro, ANSI, Rosa",teclado magnetico gamer madlions mad68 pro rgb switch gateron jade esport pro ansi rosa,529.99,,,BRL,,retailer_offer,,,,,,https://www.terabyteshop.com.br/produto/41474/teclado-magnetico-gamer-madlions-mad68-pro-rgb-switch-gateron-jade-esport-pro-ansi-rosa,https://img.terabyteshop.com.br/produto/m/teclado-magnetico-gamer-madlions-mad68-pro-rgb-switch-gateron-jade-esport-pro-ansi-rosa_267645.jpg,False,False,False,2026-05-02,2026-05-02 04:44:06.185 -0300,market_web_listings_raw_202605041156.csv,08162e42-0a5f-4b5a-a7a8-4a32705e5fd6
terabyte,teclado gamer,teclado,"Teclado Mecânico Gamer PCYes Kuromori Voyager Edition, Switch Outemu Red, 60%, ABNT2, Preto e Amarelo, KMVY60RD",teclado mecanico gamer pcyes kuromori voyager edition switch outemu red 60 abnt2 preto amarelo kmvy60rd,159.99,,,BRL,,retailer_offer,,,,,,https://www.terabyteshop.com.br/produto/40606/teclado-mecanico-gamer-pcyes-kuromori-voyager-edition-switch-outemu-red-60-abnt2-preto-e-amarelo-kmvy60rd,https://img.terabyteshop.com.br/produto/m/teclado-mecanico-gamer-pcyes-kuromori-voyager-edition-switch-outemu-red-60-abnt2-preto-e-amarelo-kmvy60rd_263033.jpg,False,False,False,2026-05-02,2026-05-02 04:44:06.185 -0300,market_web_listings_raw_202605041156.csv,612a3d8f-4b5d-4efd-91d6-09bca6ac9cfb
terabyte,teclado gamer,teclado,"Teclado Mecânico Gamer PCYes Kuromori Voyager Edition, Switch Outemu Blue, 60%, ABNT2, Preto e Amarelo, KMVY60BL",teclado mecanico gamer pcyes kuromori voyager edition switch outemu blue 60 abnt2 preto amarelo kmvy60bl,159.99,,,BRL,,retailer_offer,,,,,,https://www.terabyteshop.com.br/produto/40607/teclado-mecanico-gamer-pcyes-kuromori-voyager-edition-switch-outemu-blue-60-abnt2-preto-e-amarelo-kmvy60bl,https://img.terabyteshop.com.br/produto/m/teclado-mecanico-gamer-pcyes-kuromori-voyager-edition-switch-outemu-blue-60-abnt2-preto-e-amarelo-kmvy60bl_263037.jpg,False,False,False,2026-05-02,2026-05-02 04:44:06.185 -0300,market_web_listings_raw_202605041156.csv,7e322d56-fe59-4583-81b3-895886caaf08
terabyte,combo teclado mouse,mouse,Combo Teclado e Mouse Dr. Office DC100 USB Preto,combo teclado mouse dr office dc100 usb preto,19.99,,,BRL,,retailer_offer,,,,,,https://www.terabyteshop.com.br/produto/40154/combo-teclado-e-mouse-dr-office-dc100-usb-preto,https://img.terabyteshop.com.br/produto/m/combo-teclado-e-mouse-dr-office-dc100-usb-preto_261597.jpg,False,False,False,2026-05-02,2026-05-02 04:44:20.413 -0300,market_web_listings_raw_202605041156.csv,d9b6d074-ee30-456d-978a-0eed5ad1a841
terabyte,combo teclado mouse,mouse,Combo Teclado e Mouse Keytime Minimal USB Preto,combo teclado mouse keytime minimal usb preto,29.99,,,BRL,,retailer_offer,,,,,,https://www.terabyteshop.com.br/produto/35514/combo-teclado-e-mouse-keytime-minimal-usb-preto-kyt0015,https://img.terabyteshop.com.br/produto/m/combo-teclado-e-mouse-keytime-minimal-usb-preto-kyt0015_234689.png,False,False,False,2026-05-02,2026-05-02 04:44:20.413 -0300,market_web_listings_raw_202605041156.csv,20883364-210e-4097-9cef-d657bb6fb1ca
terabyte,combo teclado mouse,mouse,Combo Mouse e Teclado Dr. Office SDR-0302-G Sem Fio,combo mouse teclado dr office sdr 0302 g sem fio,8.83,,,BRL,,retailer_offer,,,,,,https://www.terabyteshop.com.br/produto/23683/combo-mouse-e-teclado-dr-office-sdr-0302-g-sem-fio-usb-cinza-metalico,https://img.terabyteshop.com.br/produto/m/combo-mouse-e-teclado-dr-office-sdr-0302-g-sem-fio-usb-cinza-metalico_161304.png,False,False,False,2026-05-02,2026-05-02 04:44:20.413 -0300,market_web_listings_raw_202605041156.csv,aea39ae6-b837-46e0-9f22-a18390c033a9
terabyte,combo teclado mouse,mouse,Combo Gamer BRX 4 em 1 Teclado Mouse Headset Pad,combo gamer brx 4 1 teclado mouse headset pad,109.99,,,BRL,,retailer_offer,,,,,,https://www.terabyteshop.com.br/produto/26977/combo-gamer-brx-4-em-1-teclado-mouse-headset-e-mousepad-cb-g059,https://img.terabyteshop.com.br/produto/m/combo-gamer-brx-4-em-1-teclado-mouse-headset-e-mousepad-cb-g059_184122.jpg,False,False,False,2026-05-02,2026-05-02 04:44:20.413 -0300,market_web_listings_raw_202605041156.csv,f6535a76-16a4-406d-8a6f-1c81c488c836
terabyte,combo teclado mouse,mouse,Combo Teclado e Mouse Logitech MK200 USB Preto,combo teclado mouse logitech mk200 usb preto,109.99,,,BRL,,retailer_offer,,,,,,https://www.terabyteshop.com.br/produto/37918/combo-teclado-e-mouse-logitech-mk200-usb-preto-920-002718,https://img.terabyteshop.com.br/produto/m/combo-teclado-e-mouse-logitech-mk200-usb-preto-920-002718_247914.jpg,False,False,False,2026-05-02,2026-05-02 04:44:20.413 -0300,market_web_listings_raw_202605041156.csv,94216f67-59cd-46fb-b642-35853a3fe7b5
terabyte,combo teclado mouse,mouse,Combo Teclado e Mouse Logitech MK540 Wireless ABNT2,combo teclado mouse logitech mk540 wireless abnt2,309.99,,,BRL,,retailer_offer,,,,,,https://www.terabyteshop.com.br/produto/10896/combo-teclado-e-mouse-logitech-mk540-advanced-sem-fio-abnt2-preto,https://img.terabyteshop.com.br/produto/m/combo-teclado-e-mouse-logitech-mk540-advanced-sem-fio-abnt2-preto_69499.jpg,False,False,False,2026-05-02,2026-05-02 04:44:20.413 -0300,market_web_listings_raw_202605041156.csv,79f5ae60-c40c-4d66-95e1-1003c1c279e0
terabyte,combo teclado mouse,mouse,Kit Teclado e Mouse Fortrek CW11 Wireless ABNT2,kit teclado mouse fortrek cw11 wireless abnt2,59.99,,,BRL,,retailer_offer,,,,,,https://www.terabyteshop.com.br/produto/39898/kit-teclado-e-mouse-fortrek-cw11-wireless-abnt2-preto,https://img.terabyteshop.com.br/produto/m/kit-teclado-e-mouse-fortrek-cw11-wireless-abnt2-preto_258089.jpg,False,False,False,2026-05-02,2026-05-02 04:44:20.413 -0300,market_web_listings_raw_202605041156.csv,3da5b870-9d7d-4f87-81a8-4a54b0064d27
